,news
3861,Penipuan Berkedok Perdagangan Berjangka Komoditi Marak di Indonesia
3862,Benarkah Nilai Investasi Properti Terus Naik?
3863,"Investasi Rp 4 T, Toyota Produksi Yaris di Brasil"
3864,Indonesia Tawarkan Peluang Investasi Infrastruktur Rp 20 Triliun ke Korea
3865,Investasi Properti di Kawasan Jabodetabek Masih Prospektif
3866,Kemenag Sebut Selama Ini Investasi Dana Haji Selalu Untung
3867,Dirut Mandiri: Investasi di Deposito Makin Tidak Menguntungkan
3868,Investasi Metro Kapsul Diklaim Lebih Murah Dibanding LRT dan MRT
3869,Apa Produk Investasi Favorit Nasabah Kaya Indonesia?
3870,Satgas Hentikan Kegiatan Penawaran Produk Investasi 5 Badan Usaha
3871,Mengapa Investasi Properti di Cikarang Lebih Menarik?
3872,Ronaldo Memilih Investasi Derivatif Paling Berisiko di Dunia
3873,Kota Baru yang Memicu Perkembangan Bekasi
3874,"Operasionalisasi Tol Bawen-Salatiga Sempat Molor, Ini Sebabnya"
3875,"Hati-hati, Berikut Modus-modus Investasi Bodong yang Patut Diwaspadai"
3876,Succorinvest: September Jadi Waktu yang Tepat untuk Investasi Saham
3877,Pelindo I Tambah Investasi di Terminal Petikemas Belawan
3878,Mudahnya Memiliki Apartemen di Cikarang
3879,Investasi Properti Terbaik di Cikarang
3880,Temukan Apartemen Murah di Dekat Jakarta
3881,Apartemen Murah Menarik untuk Investasi
3882,Perhatikan Lima Hal Ini Sebelum Investasi Properti
3883,BKPM dan Polri Pastikan Investasi di Lampung Aman
3884,"Sentil Pemda, Tjahjo Bilang Jangan Hambat Investasi Swasta"
3885,Ingin Investasi pada Mainan? Ini Tipsnya
3886,Jangan Remehkan Nilai Investasi Sebuah Mainan
3887,Rajawali Lepas 21 Persen Saham Nusantara Infrastructure
3888,"Bank Jangan Cuma Tawarkan Investasi, Tapi Juga Informasikan Risikonya"
3889,Investasi Properti yang Tepat Bagi Pasangan Muda
3890,"Tertipu Bisnis Katering, Seorang Ibu Kehilangan Modal Rp 113 Juta"
3891,Perusahaan China Siapkan Dana Besar untuk Investasi Energi di NTT
3892,Masyarakat Mulai Memilih Investasi Properti secara Teliti
3893,"Di 2018, Pelindo III Investasi Crane Rp 25 Miliar di Pelabuhan Waingapu"
3894,Lhokseumawe Tunda Kelanjutan Pembangunan Jalan Bibir Pantai
3895,"OJK Ingatkan soal Investasi Bodong, Ini Ciri-cirinya"
3896,Pemerintah Tidak Akan Ganti Kerugian Korban Investasi Ilegal
3897,Beragam Modus Baru Investasi Bodong yang Diungkap OJK
3898,"Ingin Cepat Kaya, Penyebab Banyak Orang Tertipu Investasi Ilegal"
3899,"Banyak Korban Investasi Ilegal Enggan Lapor, Mengapa?"
3900,"Untuk Investasi Jangka Panjang, Dollar AS Masih Jadi Pilihan"
3901,"Magnet Asia Masih Kuat untuk Investasi ""Fixed Income"""
3902,"Usul Investasi Dana Haji, dari Peternakan, Pertanian, hingga Kargo"
3903,Keuntungan Investasi Dana Haji yang Diterima Calon Jemaah Akan Berbeda
3904,"Potensi Kelautan dan Pariwisata Besar, China Jajaki Investasi di NTT"
3905,Kementerian PUPR Tunggu Kemenkeu Soal Pendanaan Tol Padang-Pekanbaru
3906,"Kabar Megapolitan: Investasi Yusuf Mansur, Kasus Jonru, hingga Petasan yang Tewaskan Suporter"
3907,Kenali Skema Ponzi Sebelum Terjebak Investasi Bodong
3908,"Fakta Bicara, Milenial Ternyata Lebih Senang Hidup di Apartemen!"
3909,Kasus Dugaan Penipuan Investasi Yusuf Mansur Naik ke Tahap Penyidikan
3910,"Investasi Apartemen Harusnya Untung, Bukan Buntung!"
3911,Posisi Indonesia di Antara Jalur Sutera dan Potret Hegemoni China
3912,"Tingkatkan Kapasitas Pabrik, Bayer Indonesia Investasi Rp 500 Miliar"
3913,"Mana yang Lebih Untung, Investasi Apartemen atau Deposito?"
3914,Ini Beda Investasi Langsung pada Obligasi dan Reksa Dana Pendapatan Tetap
3915,"Bicara Investasi, Kenapa Properti Selalu Menarik Daripada yang Lain?"
3916,Pemerintah Sebut Pelayanan Terpadu Satu Pintu Menjengkelkan
3917,"Rp 2 Triliun, Anggaran Infrastruktur untuk Provinsi Banten"
3918,Seskab Pastikan Presiden akan Batalkan Permen yang Hambat Pelayanan
3919,Pemerintah Bentuk Single Submission untuk Kawal Investasi Besar
3920,Satgas Waspada Investasi Tutup 11 Perusahaan Investasi Ilegal di Riau
3921,"RI Dapat Kepercayaan Dunia, Jokowi Minta Menteri Manfaatkan Momentum"
3922,Jokowi Minta Ikatan Notaris Dukung Percepatan Investasi
3923,Luhut: Investor Singapura Minat Investasi Rp 2 Triliun LRT Jabodebek
3924,"Perusahaan Energi Swasta Investasi Rp 1,5 Triliun di Kupang"
3925,"Djarot: Investasi Sudah Besar, Pulau Reklamasi Tak Boleh Ditelantarkan"
3926,Hati-hati Terjebak Investasi Bodong karena Skema Ponzi
3927,Kalahkan Inflasi dengan Investasi Sejak Muda
3928,Investasi di Perdagangan Berjangka Pun Harus Waspada yang Ilegal
3929,Bahaya Investasi Bodong dengan Skema Ponzi
3930,Pupuk Indonesia Investasi untuk Riset
3931,Reza Rahadian Utamakan Investasi untuk Adik dan Ibunya
3932,BUMN China Tertarik Investasi di Bandara Baru Bali
3933,"Ditabrak atau Terbalik, Ancaman Saat Truk Overload"
3934,"Investasi Bodong Kian Marak, OJK Minta Masyarakat Lapor"
3935,"Janjikan Untung Selangit, Waspadai Tawaran Investindo Amazon"
3936,Investasi Bodong di Sulawesi Barat Catut Nama Presiden Soekarno
3937,Izin Perolehan Lahan Dinilai Hambat Investasi Lapangan Golf
3938,Exxon Investasi 100 Juta Dollar AS Kembangkan Lapangan Kedung Keris
3939,Investor Australia Masih Ragu Tanam Modal di Indonesia
3940,Berapa Investasi untuk Menyulap Bali Utara Menjadi Nusa Dua?
3941,Jawa Barat Mengalami Kemajuan Signifikan
3942,Polisi: Ratusan Warga Pati Jadi Korban Penipuan Investasi UN Swisindo
3943,Pertimbangkan Hal Ini Sebelum Investasi di Mata Uang Digital
3944,Investasi Tol Semarang-Solo Capai Rp 100 Miliar Per Kilometer
3945,OJK Optimalkan Instrumen Investasi untuk Pembiayaan Infrastruktur
3946,Komposisi Investasi Dana Haji untuk Infrastruktur Harus Diatur
3947,Empat Hal Ini Harus Diperhatikan Sebelum Investasi Dana Haji
3948,Investasi Dana Haji Juga Pernah Dilakukan di Era SBY...
3949,"Bertemu Jokowi, Wakil PM Singapura Bahas Ekonomi Digital dan Investasi di Batam"
3950,Tips Mudah Bedakan Investasi Bodong atau Tidak
3951,Investasi Dana Haji ke Proyek Infrastruktur Lebih Menguntungkan
3952,"Akhir 2017, BTN Bentuk Anak Usaha Asuransi dan Manajemen Investasi"
3953,"Wapres: Ekonomi Kuartal II 2017 Tumbuh Stagnan, Pemerintah Dorong Investasi"
3954,"Investasi dan Ekspor, Alasan RI Hapus ""Calling Visa"" untuk Pakistan"
3955,"Honda ""Terbaek"" Soal Investasi Litbang di Jepang"
3956,Ini Proyek Infrastruktur yang Cocok untuk Investasi Dana Haji
3957,"Cegah Korupsi, Pemerintah Pastikan Investasi Dana Haji Diawasi Ketat"
3958,"Dana Haji untuk Investasi, Apa Untungnya Buat Umat?"
3959,"Menaker Buka Peluang Investasi Pelatihan Kerja, Ini Manfaatnya"
3960,Djarot Akan Bicara Peluang Investasi di Jakarta kepada Pebisnis Rusia
3961,"Berawal dari Facebook, Fitri dan Novi Jadi Korban Investasi Bodong"
3962,Belajar Dari Banyaknya Masyarakat yang Jadi Korban Investasi Ilegal
3963,Inflasi Jawa Barat Juli Ini Terkendali
3964,"Diresmikan Jokowi, Urusan Lahan Tol Medan-Tebingtinggi Kelar Agustus"
3965,Wapres: Investasi Dana Haji Akan Untungkan Jemaah Haji
3966,"Bantu Investor, Pemerintah Segera Bentuk Satgas Pendampingan Investasi"
3967,Kenapa Pemerintah Sulit Hapus Aturan Penghambat Investasi?
3968,"Dana Haji Bisa Diinvestasikan di Infrastruktur, asal..."
3969,DPR Akan Minta Penjelasan Menteri Agama soal Investasi Dana Haji
3970,Investasi Dana Haji untuk Infrastruktur Dikhawatirkan Bias Kepentingan
3971,Pimpinan DPR Khawatir Investasi Dana Haji Tak Sesuai Undang-Undang
3972,"Dapat Investasi Ratusan Juta Dollar AS, Ini yang Akan Dilakukan Traveloka"
3973,"Demokrat Ingatkan Jokowi, Investasi Dana Haji Harus Disetujui DPR"
3974,5 Kemalasan Kecil Tapi Berakibat Kerugian Uang
3975,Empat Prasarana Pengendali Banjir Dibangun di Riau
3976,Penjelasan Wapres Kalla soal Investasi Dana Haji untuk Infrastruktur
3977,"Waspada, Jerat Investasi Ilegal Masih Menghantui Masyarakat Indonesia"
3978,"Pembebasan Lahan Tol Jabodetabek Butuh Dana Rp 42,38 Triliun"
3979,"Pemerintah Habiskan Rp 17,27 Triliun demi Lahan Tol Trans Jawa"
3980,Israel Mulai Tergerak Investasi Infrastruktur Besar-besaran
3981,"Kurang Sebulan Lagi, Enam Ruas Tol Baru Dibuka untuk Umum"
3982,Apakah Isu Radikalisme Jadi Hambatan Investasi di Indonesia?
3983,Hong Kong Ingin Jadi Penghubung Investasi China di Indonesia
3984,Enam Pedoman dalam Mengelola Investasi
3985,Jokowi Minta Perusahaan Jepang Perluas Investasi ke Luar Jawa
3986,Basuki Curhat soal Tol Trans-Sumatera kepada Presiden Bank Dunia
3987,Basuki: Pembangunan Infrastruktur Jor-joran untuk Hapus Kesenjangan
3988,Sri Mulyani Tantang Bank Dunia Ikut Entaskan Kemiskinan di Indonesia
3989,Krisis 1998 Penyebab Kesenjangan Infrastruktur Indonesia
3990,"Pecah Rekor, Grab Resmi Dapat Tambahan Modal Rp 26 Triliun"
3991,Polda Jatim Panggil Pelapor Kasus Investasi Yusuf Mansur
3992,Jokowi Mengaku Tak Ingin Terlalu Condong ke Barat atau ke China...
3993,"Temu Bilateral, Indonesia-Selandia Baru Akan Bahas Investasi Geotermal"
3994,"Investor EBT: Regulasi Terus Berubah-ubah, Ini Menyulitkan Kami..."
3995,China Ingin Jadikan Indonesia sebagai Basis Produksi
3996,"Kenaikan Gaji Lebih Kecil dari Kenaikan Biaya Pendidikan, Solusinya?"
3997,Menteri Susi: Anda Mau Investasi Apa Mau Nyolong?
3998,"Tak Hanya Jadi Aksesori, Berlian Bisa Jadi Instrumen Investasi"
3999,"Melirik Peluang Menarik Investasi Properti di TB Simatupang, Jakarta Selatan"
4000,Kasus Investasi Emas Bodong di Solo Diduga Libatkan Jaringan Luar Kota
4001,Djibouti Dijadikan Pangkalan Militer Pertama China di Luar Negeri
4002,Pembangunan Jalan Tol Balikpapan-Samarinda Terus Dikebut
4003,"Bendungan Teritip Beroperasi, Pasokan Air Balikpapan Bertambah"
4004,Koleksi Barang Bermerek Bisa Jadi Investasi (2)
4005,Rio Dewanto: Koleksi Sepatu Jadi Investasi
4006,"Ekonomi Oke, Indonesia Jadi Incaran Negara Asing untuk Investasi"
4007,5 Tips dan Trik Dalam Memilih Investasi Lahan Kosong
4008,"Dugaan Investasi Bodong di Solo, YM Kembali Dilaporkan ke Polisi"
4009,"Hati-hati Investasi Ilegal, Tiga Perusahaan Ini Berhasil Ditutup"
4010,"Uang Tak Kunjung Cair, Anggota Arisan ""Mama Gaul"" Lapor Polisi"
4011,"Kunjungan Jokowi ke Turki Hasilkan Investasi Rp 6,7 triliun"
4012,Harga Minyak dan Regulasi Buat Investasi Sektor Migas Sepi Peminat
4013,"Semester I, Investasi di Hulu Migas Tidak Menggembirakan"
4014,"Polisi Solo Bongkar Penipuan Berkedok Investasi Emas, 2 Orang Ditahan"
4015,Tol Aceh-Sumut Masih Tahap Penyusunan Dokumen Pengadaan Tanah
4016,"Ternyata, Saham Belum Tentu Pilihan Investasi Terbaik"
4017,"Bangun Pabrik Petrokimia, LG Gelontorkan Investasi Rp 17 Triliun"
4018,"Jadi Ladang Investasi, ""Rest Area"" Tematik di Jalan Tol Akan Dibangun"
4019,Jalan Tol akan Dibangun di Wilayah Selatan Pulau Jawa
4020,Jokowi Ajak Diaspora Tarik Investasi Asing ke Indonesia
4021,MTN Pemerintah Dapat Rating Layak Investasi dari Moody's
4022,Cara Evan Dimas Investasi untuk Masa Depan
4023,Bendungan Temef Bisa Atasi Banjir di Kabupaten Malaka
4024,"Di Balik Apresiasi Terhadap Tol Trans-Jawa, Masih Ada Pekerjaan Besar"
4025,"Meikarta, Jalan Tol Layang Jakarta-Cikampek, dan Kebijakan yang Naif"
4026,Mossad Galang Dana untuk Dapatkan Teknik Mata-Mata Terbaru
4027,"Belanja Infrastruktur Kementerian PUPR Capai Rp 30,83 Triliun"
4028,13 Proyek Baru Bakal Masuk Prioritas KPPIP
4029,Bappenas Promosikan Investasi dan Pariwisata Indonesia di Australia
4030,Pindah ke Investasi Syariah? Ini Pertimbangannya
4031,OJK Hentikan Kegiatan 3 Perusahaan Investasi Tak Berizin
4032,"Baru Empat Bulan Digunakan, Jalan Rp 3,9 Miliar Rusak Berat"
4033,"Berkas Perkara Lengkap, Bos Pandawa Group Segera Disidang"
4034,Pengangguran di Semarang Diprediksi Berkurang
4035,"Tak Perlu Sedih, Ini 5 Manfaat Finansial bagi Jomblo!"
4036,Empat Warga Surabaya Laporkan Yusuf Mansur ke Polda Jatim
4037,"Pertumbuhan Ekonomi Kuartal II 2017 Diprediksi Membaik, Ini Sebabnya"
4038,Produk-produk Baru Reksa Dana Ini Jadi Alternatif Investasi Anda
4039,"Teknologi ""Jaring Laba-laba"" Bisa Berperan Lebih Luas"
4040,"Permudah Investasi, KESDM Pangkas Ratusan Perizinan"
4041,Investasi Sektor ESDM 2017 Ditargetkan 43 Miliar Dollar AS
4042,Investasi Sektor ESDM Tahun 2016 Capai 27 Miliar Dollar AS
4043,Investasi di Semarang Melonjak Tajam
4044,"Investasi Rp 400 Miliar, Kemasan Coca-Cola Indonesia Ramah Lingkungan"
4045,"Mulai Tahun Ini, Indonesia Jadi Tujuan Investasi Para Investor Global"
4046,"Dekati Pemimpin Negara Muslim, Jokowi Ingin Investasi di Indonesia Tak Hanya Barat"
4047,"""Warga Medan yang Berinvestasi dengan Yusuf Mansur, Datangilah Kami"""
4048,"Karena Tol Trans-Jawa, Usaha Kecil di Pantura Terancam Gulung Tikar"
4049,"Sewindu Tak Dibahas, DPRD Sebut Pintu Tol Pattimura Hanya Mimpi"
4050,"Skema Ponzi, Modus Investasi Palsu Legendaris yang Banyak Memakan Korban"
4051,Kabupaten Sumba Timur Butuh 5 Bendungan
4052,Unilever Komitmen Terus Tingkatkan Investasi di Indonesia
4053,Jokowi: Oknum-oknum Penghambat Investasi Harus Hilang...
4054,"Investasi Rp 1,2 Triliun, Lippo Bangun Mal Pertamanya di Jember"
4055,"Bahas Investasi, Wapres Bertemu Sumitomo-Mitsui Banking Corporation"
4056,"Mulai Dibangun, Tol Bandara-Kunciran Masuki Tahap Pembersihan Lahan"
4057,"18 Juni, GT Cibubur Utama dan Cimanggis Utama Tak Lagi Difungsikan"
4058,Kanada dan Belanda Berminat Investasi Tol dan Listrik di Indonesia
4059,Pemerintah Klaim Pemodal Asing Mulai Lirik Investasi di Infrastruktur
4060,Satgas Waspada Investasi OJK Himpun Informasi Soal Investasi Yusuf Mansur
4061,Investor Rusia Investasi  Rp 146 Triliun di KEK Tanjung Api-Api
4062,Indonesia Berambisi Kalahkan Vietnam dalam Kemudahan Berbisnis
4063,Apa Bukti Kepemilikan Investasi Reksa Dana?
4064,Perkembangan Terbaru Tol Balikpapan-Samarinda
4065,Pemerintah Siapkan Perlindungan Investasi untuk Investor Timur Tengah
4066,Pemerintah Ingin Ada Perlindungan Investasi dengan Negara-negara Arab
4067,"Bangun Galeri Investasi ""Online"" di Jayapura, BEI Perluas Edukasi"
4068,"Tak Punya Anggaran Rp 60 Juta, Babel Kesulitan Ikut Promo Investasi di Singapura"
4069,Bank Kustodian Jadi Alasan Investasi Reksa Dana Anda Aman
4070,Investasi di Industri Komoditas Sebabkan Optimisme Daya Beli Masyarakat Meningkat
4071,"Kejar Mudik H-10 Lebaran, Jalan Raya Grobogan Dibetonisasi"
4072,Cerita Luhut Soal Investasi China dan Wanti-wanti Jokowi Soal Komunisme
4073,Pemerintah Harapkan Investasi dan Kapasitas Industri Baja Meningkat
4074,Kekurangan Dana Tol Trans-Sumatera Capai Rp 20 Triliun
4075,"Menlu Luxemburg Akan Bertemu Menlu Retno di Jakarta, Bahas Investasi"
4076,"Menuju Timur Jawa, Pemudik Bisa Lewati Jalur Alternatif Ini"
4077,OJK Hentikan Kegiatan 3 Perusahaan Penghimpunan Dana Ilegal
4078,"Tidak Disangka, Benda-benda Ini Bisa Jadi Investasi Menguntungkan"
4079,Ridwan Kamil Lobi Pebisnis Asal Swedia untuk Investasi di Bandung
4080,Presiden Putuskan Investasi dari China Diurus Luhut Panjaitan
4081,Amankah Investasi Saat Kinerja Reksa Dana Minus?
4082,"Alasan Jokowi Libatkan TNI, Polri, dan BIN dalam Urusan Investasi"
4083,"Proyek Jembatan Flores Senilai Rp 5,2 Triliun Dikerjakan Akhir 2017"
4084,"""Investasi Bukan Ancaman bagi Bangsa Indonesia..."""
4085,"Dapat Tugas Jelaskan Investasi Asing Bukan Ancaman, Ini Kata Panglima TNI"
4086,"Tak Mau Investasi Terganggu, Luhut Minta Jangan Ada yang Asal ""Ngoceh"""
4087,"Meski Sudah Layak Investasi, Perekonomian RI Harus Terus Dibenahi"
4088,Jokowi: Masih Banyak Hal Kecil yang Menyebabkan Investor Kecewa
4089,"Banyak Kecelakaan, BPJT Diminta Tinjau Ulang Tarif Tol Semarang-Solo"
4090,"H-15 Lebaran, 4 Jalan Layang Jalur Tegal-Purwokerto Rampung"
4091,"Jalan di Lebak Rusak Parah, Legislator Minta Perbaikan Menyeluruh"
4092,"Ada Proyek Tol Layang Jakarta-Cikampek, Siap-siap Hadapi Kemacetan"
4093,"Mudik ke Jawa? Manfaatkan 8 ""Rest Area"" di Jalan Tol Jakarta-Cikampek"
4094,"Jaga Ketahanan Energi, Holding BUMN Migas Akan Investasi Rp 1.500 Triliun"
4095,Gubernur NTT Minta Jokowi Tambah 3 Bendungan
4096,Uni Emirat Arab Minta Perlindungan Investasi ke Jokowi
4097,Waspadai Titik Rawan Kecelakan di Tol Bawen-Salatiga
4098,"Investasi Migas Makin Lesu, Apa Harapan Pengusaha?"
4099,"TMJ Siapkan ""Rest Area"" Tambahan di KM 49 Tol Bawen-Salatiga"
4100,"Tembus Bukit Polosiri, Tol Bawen-Salatiga Berfungsi H-7 Lebaran"
4101,"Khawatir Tragedi Brexit, TMJ Rapat Sembilan Kali"
4102,Baru Tujuh Bendungan Selesai Dikerjakan Pemerintahan Jokowi
4103,SKK Migas Tanda Tangani Enam Kesepakatan Gas
4104,Tarik Ulur Kebijakan Reklamasi Dinilai Rugikan Iklim Investasi
4105,"Wacana Ganjil-Genap Saat Mudik, Ini Permintaan Ganjar Pranowo"
4106,Aviary Hotel Bintaro Tawarkan Kandang Burung Raksasa
4107,"H-10 Lebaran 2017, Jalan Tol Fungsional Bisa Dilewati Pemudik"
4108,Ganjar Pranowo: Dari Grinsing Pemudik Harus Lewat Pantura Kendal
4109,Pembebasan Lahan Tol Semarang-Batang Terganjal Tanah Wakaf
4110,"Setya Novanto Resmikan Sumur Bor Rp 5,5 Miliar di NTT"
4111,Keluarga Menantu Trump Larang Wartawan China Liput Forum Investasi
4112,"Demi Pemerataan, Sejumlah Infrastruktur Dibangun di Maluku Utara"
4113,Investasi Ini Janjikan Untung Lebih dari 10 Persen Per Tahun
4114,Konferensi Pelabuhan Internasional di Bali Berpotensi Datangkan Investasi
4115,"Sambut Pertemuan Tahunan IMF, Pemerintah Bangun Infrastruktur Baru"
4116,Investasi yang Wajib Dimiliki Seorang Ayah
4117,"Pertumbuhan Ekonomi RI 2017 Bisa Capai 5,2 Persen"
4118,"Selain Investasi di Pasar Modal, Beberapa Instrumen Ini Bisa Menjadi Pilihan"
4119,"Rebel Beach Club Raup Rp 3,2 Miliar Per Bulan dari Le Pirate"
4120,Ini Sebab Koperasi Sering Disalahgunakan Jadi Lembaga Investasi Ilegal
4121,"Hindari Investasi Bodong, Tokoh Agama dan Masyarakat Juga Perlu Edukasi Keuangan"
4122,Kadin Dukung Upaya Tarik Investasi Sektor Pelabuhan dari Hongkong
4123,Siti Fadilah Merasa Tak Tahu Uangnya Digunakan untuk Investasi
4124,5 Hal yang Harus Diperhatikan Agar Untung Investasi di ETF
4125,Turki Lirik Investasi Infrastruktur di Indonesia
4126,Taspen Alihkan Investasi dari Deposito ke SUN dan Reksadana
4127,Bupati Pandeglang Minta Kementerian PUPR Perbaiki Jalan Rusak
4128,"Bertemu Jokowi, Pengusaha Hongkong Ini Komitmen Tingkatkan Investasi di RI"
4129,Kedatangan Raja Salman Dorong Pertumbuhan Kinerja Hotel di Indonesia
4130,"Pemerintah Kebut Pembangunan ""Overpass"" Pantura Jawa"
4131,"Libur Panjang, Basuki Tinjau Kesiapan Jalur Mudik di Pantura Jawa"
4132,Waspadai Penawaran Investasi Ilegal
4133,"Reksa Dana atau Emas, Mana yang Lebih Baik bagi Investor Pemula?"
4134,Pemerintah “Korting” Tarif Importasi IKD
4135,PGN Pertanyakan Investasi Pengadaan Dispenser Gas di SPBU
4136,"Bangun Rusunami Buruh, PP Investasi Rp 4 Triliun"
4137,Singapura Siap Tanam Investasi di Kawasan Danau Toba
4138,Perusahaan Australia Jajaki Potensi Investasi di Sumut
4139,Dubes Malaysia Sebut Investasi di Indonesia Kini Lebih Mudah
4140,Panasnya Pilkada DKI Tak Berdampak Signifikan terhadap Investasi Asing
4141,Investasi China di Indonesia Terus Meningkat
4142,"Kuartal I 2017, Realisasi Investasi di Indonesia Capai 165,8 Triliun"
4143,"Bangun Republik, Swasta Bisa Manfaatkan Skema PINA"
4144,"Setelah 8 Tahun, Ini Rapor Kolaborasi Indonesia-Australia"
4145,Diler i BMW Astra Telan Investasi Rp 108 Miliar
4146,"Pasar Besar, Jokowi Dorong Investasi Industri Otomotif di Indonesia"
4147,"Jalur Kuningan-Cirebon Ambles, Basuki Kirim Bantuan Fisik"
4148,Jokowi Harap Investasi Jepang Tularkan Disiplin ke SDM Indonesia
4149,"Resmikan Pabrik Mitsubishi, Jokowi Tegaskan Investasi Tak Boleh Dipersulit"
4150,Berapa Ekspektasi “Return” yang Wajar di Reksa Dana Campuran?
4151,"Libur Isra Mi'raj, Okupansi Hotel di Semarang Naik 30 Persen"
4152,OJK Himbau Masyarakat Waspada Terhadap Investasi Jual Beli Pulsa Elektronik
4153,Patra Jasa dan Pelni Investasi Kapal Pesiar
4154,Ajarkan Investasi pada Anak Sejak Dini
4155,Waspada Investasi Ilegal di Depan Anda
4156,Pernyataan Bupati Boyolali Dinilai Tak Sesuai Logika Investasi
4157,"167.000 Kendaraan Masuk ke Jakarta Selepas ""Long Weekend"""
4158,Tarif Tol Akses Tanjung Priok Diintegrasikan dengan JORR
4159,Sengitnya Perdebatan Indonesia-Jepang di Tol Akses Tanjung Priok
4160,"Ditanya soal Kekecewaan terhadap Raja Salman, Jokowi Sebut Cuma Guyon"
4161,"Gratis, Lewat Tol Akses Tanjung Priok Selama Sebulan"
4162,"Sabtu Siang, Jokowi Resmikan Jalan Tol Akses Tanjung Priok"
4163,Indonesia Bukan Pilihan Utama Investasi Saudi
4164,"Apa Efeknya Jika S&P Tidak Berikan Peringkat ""Investment Grade""?"
4165,Kekecewaan Jokowi Usai Melihat Nilai Investasi Arab Saudi di China...
4166,Perhatikan Beberapa Hal Berikut Agar Tidak Terjebak Investasi Bodong!
4167,Indonesia Peroleh Predikat Layak Investasi
4168,"Khusus Pasar Indonesia, Agen Properti AS Targetkan Menjual 100 Rumah"
4169,Republik Angola Tawarkan Peluang Investasi ke Pengusaha Indonesia
4170,Orang Berpendidikan Kerap Jadi Korban Investasi Ilegal
4171,Buka Rekening Investasi Kini Cuma Butuh Waktu Sekejap
4172,Gubernur Sumut Tawarkan Investasi Energi Terbarukan kepada Perancis
4173,"""Waspadai Praktik 'Investasi Pilkada'"""
4174,"Area Bendungan Jragung Terus Menyusut, Warga Minta Segera Direlokasi"
4175,Ingin Investasi? Ini Pilihan Reksa Dana yang Tepat Tahun Ini
4176,"Tak Lagi Bisa Batalkan Perda, Pemerintah Khawatirkan Nasib Investasi"
4177,Konser Musisi Internasional Bisa Tumbuhkan Iklim Investasi
4178,Pemerintah Bentuk Unit Khusus Tangani Revitalisasi Rawapening
4179,"Masuk Program Nasional, Desain Bendungan Jragung Siap Disertifikasi"
4180,"Satu Hektar Per Hari, Target Pembersihan Eceng Gondok Danau Rawapening"
4181,"Bertemu Basuki, Bupati Semarang Curhat Soal  Jembatan ""Maut"" Sunut"
4182,Potensi Bisnis Kondotel di Bali Masih Andalkan Pantai
4183,BI Harap Pemerintah Terus Lakukan Deregulasi
4184,"Mendagri Tak Bisa Batalkan Perda, Investasi Dinilai Tak Akan Terhambat"
4185,"Pemerintah Butuh Rp 4,5 Triliun Bangun 4 Bendungan"
4186,"Bangun 4 Bendungan, Basuki Ajukan Proposal Pinjaman ke China"
4187,"Bahas Pengelolaan SDA, Basuki Gelar Rapat dengan China"
4188,"Kurangi Beban di Darat, Arus Mudik Bakal Dialihkan Lewat Laut"
4189,Wapres JK: Investasi di Afganistan Masih Terhalang Keamanan
4190,"Cegah Tragedi ""Brexit"", Pemerintah Rahasiakan Operasional Tol Baru"
4191,Pemerintah-DPR Kompak Merespons Jembatan Trans-Timor yang Terputus
4192,"Presiden Geram, 23 Aturan Kementerian Penghambat Investasi Segera Dihapus"
4193,Maudy Ayunda: Investasi di Properti Paling Aman
4194,"Cegah Insiden 'Brexit', BUJT Harus Pasang Sistem Informasi Tol"
4195,Seskab Pastikan 23 Permen yang Hambat Investasi Akan Dicabut
4196,Jokowi Sebut 2018 Tahun yang Penting untuk Selesaikan Proyek Infrastruktur
4197,Sebagian Tol Trans-Jawa Bisa Dijajal Saat Mudik Lebaran 2017
4198,Jokowi Sebut Masih Ada Kementerian yang Bikin Aturan Hambat Investasi
4199,"LMAN Ganti Biaya Pengadaan Tanah BUJT Rp 13,1 Triliun"
4200,Coba 4 Produk Investasi Ini untuk Biaya Pendidikan Anak
4201,"25 Tahun Berdiri, Coca-Cola Amatil Indonesia Investasi Rp 21 Triliun"
4202,"Malaysia ""Musuh Utama"" Indonesia"
4203,"Sinergikan Lintas Departemen, Kemenpar Gelar Rakornas Pariwisata"
4204,Nilai Investasi Perancis ke Indonesia Rp 35 Triliun
4205,"Peringkat Indonesia dalam Kemudahan Investasi Naik, Jokowi Belum Puas"
4206,"Bertemu Jokowi, Pengusaha Perancis Ingin Investasi 2,6 Miliar Dollar AS"
4207,Situs Investasi Bodong Masih Aktif
4208,Jembatan Cisomang Sudah Bisa Dilalui Semua Kendaraan
4209,Menyoal Pembiayaan Percepatan Infrastruktur
4210,"Waspada, Investasi Bodong Makin Marak!"
4211,"Dream for Freedom, Investasi Bodong yang Tipu 700.000 Investor"
4212,OJK Hentikan Kegiatan Operasional 6 Investasi Ilegal
4213,"""Dulunya Kubangan Kerbau, Sekarang Mulus Berlapis Beton"""
4214,Bank Dunia Setujui Bantuan Pembiayaan Infrastruktur
4215,"Siap Dilintasi Pemudik, Begini Perkembangan Tol Medan-Tebing Tinggi"
4216,Hutama Karya Gerilya Cari Dana Tol Trans-Sumatera
4217,Ini Cara Menghindari Dokumen Investasi Palsu
4218,Pemerintah Kaji Moratorium Koperasi Simpan Pinjam untuk Tekan Investasi Bodong
4219,SMI Pastikan Bantu Pembiayaan LRT Jabodebek
4220,Inilah Alasan Tas Mewah Bisa Disebut Investasi
4221,Taiwan Tertarik Investasi Rp 20 Triliun di Morotai
4222,Wali Kota Toyota Jepang Ingin Investasi di Bandung Teknopolis
4223,Pembebasan Lahan Tol Batang-Semarang Tembus 87 Persen
4224,Adhi Karya Pastikan LRT Jabodebek Beroperasi 2019
4225,Musim Hujan Ganggu Konstruksi Tol Bocimi
4226,SMI Targetkan Pembiayaan Infrastruktur Tahun Ini Rp 66 Triliun
4227,"Tak Rapi, Pengerjaan Jalan Tol ""Kejar-kejaran"""
4228,"Sri Mulyani: Akibat Korupsi, Biaya Infrastruktur Membengkak"
4229,"8 Tahun SMI Biayai Infrastruktur Rp 198,3 Triliun"
4230,Walhi Nilai Penghentian Reklamasi Tak Mengganggu Investasi
4231,"Dorong Kemudahan Investasi, Proses Registrasi Lahan Dipercepat"
4232,"Peringkat Kemudahan Investasi Indonesia Loncat, Negara Lain ""Gerah"""
4233,"Dukung Percepatan Proyek Strategis, Banten Siapkan Tim Pembebasan Lahan"
4234,"Perusahaan Jerman Berminat Investasi ""Smelter"" Nickel Rp 10,4 Triliun"
4235,Pemkot Yogyakarta Anggarkan Rp 15 Miliar Perbaiki Lima Ruas Jalan
4236,Dua Perusahaan Jerman Berminat Investasi 800 Juta Dollar AS
4237,Waskita Tagih Pemerintah Dana Talangan Lahan Tol Rp 8 Triliun
4238,Pembangunan Tol Layang Jakarta-Cikampek Tuntas 2018
4239,"Saat Sandiaga ""Ditodong"" untuk Investasi di Pulau Reklamasi"
4240,Ini Aneka Investasi yang Bisa Dilirik di Era MEA
4241,"2 Tahun Pemerintah Bangun 520,8 Kilometer Jalan Perbatasan Kalimantan"
4242,"Tak Hanya PLBN, Jalan di Perbatasan Juga Terus Dikebut Pengerjaannya"
4243,Jurus Ampuh Menaklukkan Inflasi
4244,6 Hal yang Perlu Anda Timbang Sebelum Berinvestasi
4245,Bisakah Perhiasan Mutiara Jadi Investasi?
4246,Pemerintah Pusat Diminta Benahi Jalan di Perbatasan Timor Leste
4247,Kementerian PUPR Studi Revitalisasi Danau Laut Tawar
