,news
2729,"Kerek Nilai Investasi Praxis, Intiland Jalin Kerja Bareng Travelio"
2730,"Menurut Ekonom, Investasi Asing yang Masuk Harus Terus Dikontrol"
2731,"Ekonomi Dunia Lesu, Tiga Sektor Ini Diprediksi Bakal Bergairah pada 2020"
2732,"Sempat Meroket, IHSG Kembali ke Zona Merah"
2733,"Return Tinggi Modal Kecil, Investasi Bitcoin Direkomendasikan untuk Milenial"
2734,"Game MOBA Lokal Rilis Awal 2020, Ada Karakter Gajah Mada Dkk"
2735,Intip Cara Investasi Orang-orang Terkaya Dunia
2736,Pertumbuhan Ekonomi RI Bisa Tak Sampai 5 Persen jika....
2737,5 Reksadana Campuran Berkinerja Terbaik
2738,Mau Bisnis Jual Beli Tanah? Cari Tahu Risikonya Dulu
2739,Ingin Investasi Properti? Lirik Apartemen Mahasiswa
2740,OJK Imbau Masyarakat Hati-Hati Investasi Bodong Berkedok MLM
2741,Mau Lapor Investasi Bodong? Anda Bisa ke Pos Pengaduan Ini
2742,"Awal November, Harga Emas Antam Naik Rp 9.000"
2743,Warren Buffett: Kualitas Terpenting Investor Bukan Kecerdasan...
2744,"BRI Akan Terbitkan Obligasi Rp 5 triliun, Ini Besaran Bunganya"
2745,"Aman dan Terjangkau dengan KPR Hingga 75 Persen, Ini Saatnya Investasi Properti di Australia"
2746,Pembangunan Infrastruktur Dorong Kenaikan Investasi di Luar Jawa
2747,"Kuartal III 2019, Realisasi Investasi Naik 18,4 Persen Jadi Rp 205,7 Triliun"
2748,Luhut: Presiden Minta KPK Awasi Investasi di Atas 1 Miliar Dolar AS
2749,"Jokowi: Tingkatkan Investasi, Kurangi Ketergantungan pada Barang Impor"
2750,"Kewenangan Luhut Kian Luas, Kini Urusan Investasi Resmi di Tangannya"
2751,Warren Buffet : Prediksi Pasar Saham Jangka Pendek adalah Racun
2752,"Kadin: Targetkan 2.500 Km Jalan Tol, Pemerintah Perlu Dorong Investasi Swasta"
2753,Satgas Waspada Investasi Akan Gandeng Kedubes RI Berantas Fintech Ilegal
2754,Server Fintech Ilegal Ada di Luar Negeri Jadi Masalah
2755,Sebanyak 1.773 Fintech Ilegal Dihentikan hingga Oktober 2019
2756,Ingin Investasi? Simak 7 Tips Memulainya
2757,"Ditemukan, 153 Investasi Bodong Berkedok Koperasi Simpan Pinjam"
2758,"Menurut Pengamat, Ini 2 Tugas Utama Menperin Baru"
2759,Ini 5 Reksadana Pendapatan Tetap dengan Kinerja Terbaik
2760,"Laba Amazon Anjlok, Investor Mulai Gelisah"
2761,"Harga Emas Antam Naik Rp 2.000, Ini Daftar Lengkapnya"
2762,Peringkat Kemudahan Berbisnis di Indonesia Stagnan
2763,"Agar Tak Terjerat Pinjaman Online Ilegal, Pinjam Hanya untuk Kegiatan Produktif"
2764,"Artis Gemar Moge, Hobi atau Investasi?"
2765,Erick Thohir Bocorkan Alasan Jokowi Pilih Bahlil Jadi Kepala BKPM
2766,Wewenang Kementerian Maritim dan Investasi Berbenturan dengan Kemenko Perekonomian?
2767,Ini Pilihan Investasi yang Pas Saat Ekonomi Global Tak Menentu
2768,"Kronologi Penangkapan Pelaku Dana Nasabah BNI Ambon, 2 Tersangka Keluar Rumah Saat Gempa"
2769,[POPULER MONEY] Susi Teteskan Air Mata | Mantan Sopir Angkot yang Urus Investasi
2770,"INFOGRAFIK: Profil Luhut Pandjaitan, Menko Kemaritiman dan Investasi"
2771,Tersangka Kuras Dana Nasabah BNI Ambon dengan Tawarkan Produk Imbal Hasil. Ini Kronologinya...
2772,"Bahlil Lahadalia Jadi Kepala BKPM, Ini Harapan Pengusaha"
2773,"Profil Luhut Binsar Pandjaitan, Menteri Koordinator Bidang Kemaritiman dan Investasi"
2774,"Wewenang Makin Luas, Luhut Sebut Posisi Menko Punya Hak Veto"
2775,Pertumbuhan Investasi di Pantura Dorong Bisnis Hotel di Pati
2776,"BNI Telusuri Dana Rp 58,9 Miliar yang Digelapkan Oknum Pegawainya"
2777,Bupati Anas Pastikan Banyuwangi Akan Jadi Destinasi Wisata Nasional
2778,RI Tawarkan Norwegia Investasi Perikanan Budidaya di Pulau Terluar
2779,"Diskusi SDM hingga Investasi dengan Jokowi, Nadiem Jabat Menteri Apa?"
2780,"Jokowi Siapkan UU Lapangan Kerja dan UKM, Dongkrak Investasi?"
2781,"Kasus Pembobolan Dana Nasabah BNI Ambon, Polisi Sebut Akan Ada Kejutan"
2782,Punya Investasi Reksa Dana? Mainkan Strategi Ini Biar Raup Untung
2783,Perusahaan China Siap Investasi Rp 2 Triliun di Aerocity Kertajati
2784,"Pembobolan Dana Nasabah BNI, Kepala Pemasaran Ambon Diduga Anggota Sindikat Investasi Tak Wajar"
2785,"Disuntik 50 Juta Dollar AS dari Jepang, Gojek Sediakan Streaming Anime"
2786,"Gelar WJIS 2019, Ridwan Kamil Targetkan Jabar Raup Investasi hingga Rp 70 Triliun"
2787,"Milenial, Ini Sebabnya Saham Harus Disertakan dalam Portofolio Kamu"
2788,Butuh Rumus Sederhana Atur Keuangan? Simak di Sini
2789,"""Dalam Periode Pertama Presiden Jokowi, Ada 2 Sektor yang Menyelamatkan FDI..."""
2790,Ini Strategi Pemdaprov Jabar Pertahankan Gelar Primadona Investasi
2791,Platform Ini Beri Bimbingan bagi Pemula yang Ingin Investasi Reksa Dana
2792,"Bupati Indramayu Ditangkap KPK, Ridwan Kamil: Korupsi Itu Musuh Investasi"
2793,"Dorong Ekspor dan Investasi, Indonesia Harus Contoh Vietnam"
2794,"Dongkrak Investasi dan Ekspor, Menhub Minta Pelaku Usaha Sinergi"
2795,Begini Tips dan Trik agar Tetap Bisa Menabung
2796,"Ini Rencana Indosat untuk Dana Rp 6,39 Triliun Hasil Jual Menara BTS"
2797,"Naik, Indonesia Duduki Peringkat 68 Indeks Global Keterbukaan Ekonomi"
2798,"Mau Memulai Investasi, Simak Langkah-Langkah Ini"
2799,[POPULER MONEY] Barang-barang yang Cocok untuk Investasi | Bos BCA soal Mobile Banking
2800,Mau Tahu Barang Apa Saja yang Cocok untuk Investasi? Cek di Sini
2801,[POPULER INTERNASIONAL] Arab Saudi Investasi Rp 900 Triliun di Industri Film | Dampak Topan Hagibis di Jepang
2802,"Demi Masa Depan, Lebih Baik Menabung atau Investasi?"
2803,Menteri Sofyan: Mafia Tanah di Banten Hambat Investasi Lotte Rp 50 Triliun
2804,"Jokowi Bangun KEK Selama 5 Tahun, Berapa Nilai Komitmen Investasinya?"
2805,Satgas Waspada Investasi Tindak 27 Entitas Investasi Ilegal
2806,Satgas Waspada Investasi Kembali Tindak 133 Pinjol Ilegal
2807,"Investasi Kian Gampang, BCA Luncurkan Aplikasi Wealth Management"
2808,"Bukalapak Dapat Suntikan Dana Baru, Valuasi Naik Jadi Rp 35 Triliun"
2809,Bukalapak Dapat Suntikan Dana dari Perusahaan Korea Selatan
2810,"Pasar Saham Terkoreksi, Saatnya Atur Kembali Portofolio Anda"
2811,"Permintaan Tinggi, Mengapa RI Belum Mampu Ekspor Produk Hortikultura?"
2812,[POPULER MONEY] KPK dan Investasi | Pesawat BJ Habibie
2813,Ingin Investasi Surat Utang Pemerintah? ORI016 Bisa Dibeli Hari Ini
2814,Kalla Sebut Ada Kaitan Revisi UU KPK dan Investasi meskipun Tak Langsung
2815,Benarkah KPK Hambat Investasi?
2816,"KPK Dinilai Tak Hambat Investasi, Pemberantasan Korupsi Baik untuk Bisnis"
2817,Pengamat: KPK Hambat Investasi Sangat Tidak Mendasar
2818,"Korupsi Marak, Investor Malas Masuk ke Indonesia"
2819,"Bantah Moeldoko, KPK Dinilai Berkontribusi Positif bagi Investasi"
2820,Aplikasi Ini Mudahkan Investasi Panel Surya
2821,Trump Pertimbangkan Coret Perusahaan China dari Bursa AS
2822,BI: Arus Modal Asing Makin Deras Masuk ke Indonesia
2823,"Tarif 13 Ruas Tol Naik, ATI Anggap Wajar untuk Mengembalikan Investasi"
2824,"Fahri Hamzah: Kalau Ada Perppu KPK, Enggak Ada Lagi yang Investasi ke Republik Ini"
2825,Tips Investasi Rumah untuk Pemula
2826,"Ada Isu Trump Bakal Dimakzulkan, Apa Dampaknya ke Ekonomi Indonesia?"
2827,"Akhir Kuartal II 2019, Posisi Net Kewajiban Investasi RI Naik"
2828,Investasi Proyek Kereta Semi Cepat Jakarta-Surabaya Rp 60 Triliun
2829,Kemenperin Sederhanakan Regulasi untuk Tarik Investasi ke RI
2830,"Ibu Muda Mau Mulai Investasi, Ini 3 Langkahnya"
2831,KSOP Marunda Ajak Semua Pihak Hormati Putusan Hukum Kasus Pelabuhan Marunda
2832,"Era Digital, Ibu Rumah Tangga Juga Bisa Investasi"
2833,Jokowi: Kita Harus Gerak Cepat Pangkas Regulasi Penghambat Investasi
2834,Selandia Baru akan Investasi SDM di Indonesia
2835,Dana Pensiun Kanada Beli 45 Persen Saham Tol Cipali
2836,Menko Darmin Ogah Komentar Saat Ditanya Apa KPK Menghambat Investasi
2837,Penjelasan Moeldoko yang Sebut KPK Hambat Investasi dan Tanggapan KPK
2838,Moeldoko Jelaskan Maksud Ucapannya soal KPK Hambat Investasi
2839,"Disebut Bisa Hambat Investasi oleh Moeldoko, Begini Jawaban KPK"
2840,Menaker: 4 dari 10 Hambatan Investasi Ada di Ketenagakerjaan
2841,"Terungkap, Ada Nasabah yang Pinjam di 141 Pinjaman Online Sekaligus"
2842,Moeldoko: KPK Bisa Menghambat Investasi
2843,Pemerintah Akui OSS Belum Mampu Sederhanakan Perizinan di Indonesia
2844," RI Larang Ekspor Nikel, Korea Minat Investasi, China Terpukul"
2845,Milenial Mau Mulai Investasi? Begini Langkahnya
2846,"Meski Pasar Belum Normal, Pancakarya Rilis Apartemen Siap Huni"
2847,"Aturan IMB Akan Dihapus, Apa Alasan Pemerintah?"
2848,30 Persen Lebih Pembeli Apartemen Suramadu adalah Milenial
2849,"Emas Harus Ada dalam Setiap Portofolio Investasi, Mengapa?"
2850,Fraksi Golkar Dukung Jawa Tengah Jadi Kawasan Industri Tekstil
2851,"Kekayaannya Tak Bekurang Meski Rajin Berdonasi, Ini Strategi Investasi Bill Gates"
2852,Kemendagri Yakin Omnibus Law Tak Akan Gerus Pendapatan Daerah
2853,Rektor Binus: Selamat untuk Platform Terbaru Edukasi Kompas.com!
2854,Pesisir Selatan Jawa Disebut Kian Rentan Bencana Akibat Investasi dan Pembangunan
2855,Penggunaan Robot Pengaruhi Arus Perdagangan dan Investasi
2856,TII: Revisi UU KPK Berita Buruk bagi Masa Depan Investasi Indonesia
2857,"Akhirnya, Pikko Land Lakukan ""Topping Off"" Proyek Thamrin District"
2858,Pembangunan Ibu Kota Baru Bisa Tangkal Risiko Resesi?
2859,"Dongkrak Investasi, Jokowi Akan Revisi 74 Undang-undang"
2860,"Jokowi Ungkap Kelemahan Pengusaha Muda Indonesia, Apa Saja?"
2861,Presiden: Jumlah Kelas Menengah di Indonesia akan Jadi Magnet Investasi
2862,Jokowi Akan Usulkan Revisi 74 Undang-Undang yang Hambat Investasi
2863,"Bongkar Penghambat Perizinan, Darmin Sebut Urus Investasi Bisa Hanya 30 Menit"
2864,Upaya Strategis Kementan Tingkatkan Investasi Bidang Tanaman Pangan
2865,Pemerintah Akan Revisi 72 Undang-undang yang Hambat Investasi
2866,Ma'ruf Amin: Habibie Telah Berikan Investasi Kemanusiaan yang Tinggi
2867,Jokowi Rapat Dua Hari Sekali demi Genjot Investasi
2868,Simak Tips Investasi Sejak Dini ala Petenis Andy Roddick
2869,KCN Dukung Usaha Presiden Jokowi untuk Dorong Investasi
2870,"Target Investasi Pertanian Naik, Izin Investor Harus Dipermudah"
2871,Satgas Investasi OJK Diminta Berhati-hati Tentukan Status Pinjaman Online Ilegal
2872,"Siapkan Uang Muka untuk Miliki Rumah Pertama, Instrumen Investasi Apa yang Paling Pas?"
2873,Ini Daftar 123 Fintech Ilegal Temuan Terbaru Satgas Waspada Investasi
2874,Swedia dan Finlandia Berminat untuk Investasi di Aceh
2875,"Kaum Milenial Unik, Investasi Apa yang Sesuai?"
2876,Modernland Tambah Pasokan Hunian Baru di Kawasan Cilejit
2877,Jubir KPK: Revisi UU KPK Ganggu Investasi dan Program Pemerintah
2878,OJK Tutup 123 Pinjam Online Illegal
2879,Tol Binjai-Langsa Bakal Telan Investasi Rp 9 Triliun
2880,Milenial Ingin Investasi? SBR008 Bisa Dibeli Mulai Hari Ini
2881,Hingga Akhir Tahun Kemendag Bakal Rampungkan 3 Perjanjian Dagang
2882,"Dorong Ekspor, Pemerintah Harus Luweskan Industri Manufaktur"
2883,"Perluas Perdagangan, Kadin Bakal Sambangi 14 Negara"
2884,Presiden Jokowi Kecewa Calon Investor Banyak Lari ke Negara Tetangga
2885,"Presiden Jokowi: Menteri Jangan Kayak Pejabat, Minta Dilayani"
2886,"Tertipu Investasi Bodong Bahan Bangunan, Ratusan Orang Lapor Polisi"
2887,Pemerintah Bakal Turunkan PPh Badan untuk Genjot Investasi
2888,Menhub Persilakan China Investasi di Proyek Transportasi Ibu Kota Baru
2889,"Perbanyak Pilihan buat Nasabah, Tokio Marine Tawarkan 3 Dana Investasi Baru"
2890,"Gandeng Unsada, Kemtecnia Investasi Rp 78 Miliar Garap Pasar Energi Terbarukan di Indonesia"
2891,"Ibu Kota Pindah, Bagaimana Minat Investasi di Kalimantan Timur?"
2892,Mustika Land Bangun Rumah Rp 200 Jutaan di Cikarang
2893,Ibu Kota Baru Berpotensi Genjot Eskpor dan Tarik Investasi Asing Baru
2894,Wagub Jabar: Untuk Capai Birokrasi 3.0 Diperlukan Investasi SDM
2895,Amazon Dikabarkan Akan Investasi di Gojek
2896,"ISEI: Jaga Momentum Pertumbuhan Ekonomi, RI Harus Genjot Manufaktur"
2897,"Bangun Ibu Kota Baru, Pemerintah Terbuka bagi Investor Asing"
2898,"Kaltim Jadi Lokasi Ibukota Baru, Saatnya Bidik Investasi Properti di Sana"
2899,Besarnya Bisnis Underwear Savage X Fenty Milik Rihanna...
2900,Gibran Rakabuming: Sebenarnya Saya dalam Posisi Serba Tidak Enak...
2901,"Pasokan Listrik Makin Baik, Gubernur Babel Pede Undang Investasi"
2902,"Soal Perubahan Nomenklatur Kementerian, Ini Kata Menko Luhut"
2903,"Dongkrak Ekspor, Phapros Incar Pasar Amerika Selatan dan Afrika"
2904,"Ibu Kota Baru di Kalimantan Timur, Begini Skema Pendanaannya"
2905,"Tantang Gojek, Grab Investasi Besar-besaran di Vietnam"
2906,"Warren Buffet Jadi Investor Sejak  Usia 11 Tahun, Bagaimana Caranya?"
2907,Hero Supermarket Kucurkan Rp 500 Miliar untuk Transformasi Gerai
2908,Raiz Luncurkan Aplikasi Penjualan Reksa Dana di Indonesia
2909,Komite Etik AFTECH Sebut Belum Perlu Undang-undang untuk Fintech
2910,"Ada Tren Suku Bunga Rendah, Saham Sektor Apa yang Pantas Dilirik?"
2911,"Perumnas Gelar Pameran Tunggal, Serius Bidik Anak Milenial"
2912,"Milenial Perlu Siapkan Dana Pensiun Sejak Dini, Begini Tips Memulainya"
2913,Jika Kerusuhan di Papua Berlarut Bisa Pengaruhi Iklim Investasi
2914,Kementerian Investasi Dinilai Tak Efektif Perbaiki Kinerja Investasi Asing
2915,Ingin Pensiun Dini? Apa Saja yang Harus Diperhatikan.
2916,"Swasta Enggan Investasi Bangun Rumah Sakit di Pelosok, Ini Sebabnya"
2917,"Tren Harga Naik, Emas Digital Makin Dilirik"
2918,Kini Tak Perlu Khawatir Investasi Emas Digital
2919,"Sengketa KCN dan KBN Masih Berlanjut, Investor Jadi Ciut"
2920,"Pidato Kenegaraan Jokowi Diprediksi Tekankan Investasi, Minim Isu Hak Rakyat"
2921,"Jelang Pidato Kenegaraan Jokowi, YLBHI Kritisi Isu Lingkungan hingga Investasi"
2922,Efek Perang Dagang Terhadap Investasi Reksa Dana
2923,"Jangan Takut Investasi Mutiara, Uji Keasliannya Pun Mudah"
2924,Pembangunan Pertanian Berhasil Dorong Kinerja Positif Ekonomi Makro
2925,"DNI akan Direvisi, Investasi Asing Minimal Rp 10 Miliar"
2926,Proyek Apartemen Royal Height Mulai Dibangun
2927,Total Investasi Esemka Rp 600 Miliar Tanpa Ada Campur Tangan Jokowi
2928,Vietnam Ingin Punya 10 Unicorn di Tahun 2030
2929,"Tiba di Kupang Siang Ini, Ahok Jajaki Investasi Pakan Ternak di NTT"
2930,"Catat, 5 Kesalahan Keuangan yang Tak Pernah Dilakukan Orang Kaya"
2931,"9 Ruas Jalan Tol Akan Diresmikan, Ini Rinciannya"
2932,"Emas Makin Mahal, Simak Instrumen Investasi Lain yang Bisa Anda Lirik"
2933,"Konsep ""One Management System"" Memudahkan Kerja Broker Milenial"
2934,Pemerintah Diminta Beri Insentif ke Perusahaan Asing yang Investasikan Dividen di RI
2935,"Perempuan Jangan Tunda Menabung untuk Pensiun, Ini Alasannya"
2936,Eropa Nilai Prospek Bisnis di Indonesia Masih Relatif Stabil
2937,"Perpres Diteken Jokowi, Indonesia Sasaran Investasi Kendaraan Listrik"
2938,"Penawaran Sukuk Tabungan ST005 Dibuka, Bisa Dibeli Mulai Rp 1 Juta"
2939,Bank Mandiri Sarankan Investor Berinvestasi di Pasar Lokal
2940,"Imbas Perang Dagang, Perusahaan China Ramai-ramai Pindah ke Malaysia"
2941,Mengenal Instrumen Risk Free Rate di Indonesia
2942,"Investasi Rp 1,25 Triliun, Jaya Real Bangun Mal dan Hotel Double Tree"
2943,Melirik Pilihan Investasi Pribadi Bos Sritex
2944,"Bos Sritex Nilai Industri Tekstil RI Perlu Dilindungi, Ini Alasannya"
2945,"Pertumbuhan Ekonomi Melambat, Penurunan Suku Bunga BI Bisa Berlanjut"
2946,Luhut: Softbank Bisa Tingkatkan Investasi di Indonesia hingga Rp 140 T
2947,Menko Darmin: Listrik Mati Pasti Merugikan...
2948,Pemadaman Listrik Bisa Jadi Sinyal Buruk Investasi di Indonesia
2949,Festival Indonesia di Moskow Bukukan Kontrak Dagang Rp 143 Miliar
2950,Diplomasi Becak Sultan HB X untuk Rusia yang Bikin Haru dan Tawa
2951,Investasi China ke Arab Saudi Melonjak 100 Persen pada Semester I 2019
2952,Mencicip Manisnya Bisnis Gerai Thai Tea
2953,Jangan Salah Langkah! Pahami 5 Kesalahan Saat Investasi Rumah
2954,Sri Mulyani: Kita Minta BUMN Berikan Ruang Lebih Bagi Swasta
2955,"Sejak Awal 2019, 826 Fintech Ilegal Sudah Diblokir"
2956,"Investasi Emas Lebih Untung Dibanding Investasi Lain, Ini Alasannya"
2957,"Terungkap, Siapa Saja Pemegang Saham Go-Jek"
2958,"Sri Mulyani Optimistis Investasi Bakal Meningkat, Ini Alasannya"
2959,Sultan HB X Jamin Pebisnis Rusia Bisa Investasi Berkesinambungan di Yogyakarta
2960,Investasi Asing Tak Akan Mampir jika Peran BUMN Masih Dominan
2961,Sarinah Tegaskan Tak Punya Bisnis Aplikasi Pinjaman Online
2962,"Nestle Investasi Rp 1,4 Triliun untuk Perluas Tiga Pabrik di Indonesia"
2963,Wapres Minta PLN dan Swasta Lirik Investasi Pembangkit Listrik Energi Terbarukan
2964,"Semester I 2019, LPS Bukukan Total Aset Hingga Rp 111,149 Triliun"
2965,Sri Mulyani: Saat Ini Dana Riset Masih Terpencar-pencar
2966,RI di Posisi Keempat Negara Paling Menarik untuk Investasi di Dunia
2967,"Investasi Emas Cocok untuk Milenial, Ini Alasannya"
2968,"UEA dan Softbank Janji Tanam Modal, Menkeu Optimistis Investasi Bakal Tumbuh"
2969, Pemerintah Rayu Pabrik Mebel Asal China Pindah Ke Indonesia
2970,RI Targetkan Negosiasi dengan Hyundai Rampung November 2019
2971,"Bertemu Jokowi, Grab Investasi Rp 28 Triliun di Indonesia"
2972,China Turun ke Posisi 3 Negara dengan Investasi Terbesar di Indonesia
2973,Makin Banyak Jumlah Tabungan Bisa Selamatkan RI dari Gejolak Global?
2974,"Realisasi Investasi di Semester I 2019 Tembus Rp 395,6 Triliun"
2975,"Investasi Rendah, Bappenas Minta Pemda Tata Ulang Aturan"
2976,"Investasi Reksa Dana Syariah, Bisa Mulai Beli dari Berapa Rupiah?"
2977,"Pengusaha: Indeks Demokrasi Meningkat, Optimisme Investor Terdongkrak"
2978,Ibu Rumah Tangga Rambah Obligasi Negara
2979,Generasi Milenial Serbu Obligasi Negara
2980,Bhakti Agung Bakal Pakai Mayoritas Dana IPO untuk Modal Proyek
2981,Grab Dapat Kucuran Dana Rp 28 Triliun untuk Ekspansi di Indonesia
2982,Trenggalek Tawarkan Investasi Wisata dengan Modal Murah ke Sejumlah Investor
2983,Menyoal Gebrakan Investasi ala Visi Indonesia
2984,"Siapkan Investasi Rp1,3 Triliun, Kairos Bangun Hotel di Bali Utara"
2985,"Wapres: Kalau Pemda Persulit Investasi, Jadinya Inflasi"
2986,"42 Proyek Sumbangkan US$ 43,3 Miliar Investasi Hulu Migas Hingga 2027"
2987,Mau Investasi Reksa Dana Syariah? Ini Ragam Pilihannya di E-Commerce
2988,"Punya Potensi Kuat, Jabar Raih Penghargaan di Sektor Investasi"
2989,"Tarik Investasi Asing, Pemerintah Perlu Lakukan 4 Langkah Strategis"
2990,Perluasan Insentif Pajak Bisa Dorong Industri Inovatif
2991,"BRANZ BSD Apartemen Jepang Beri Promo Spesial, Investasi Pasti Untung"
2992,Diversifikasi Sumber Pembiayaan Investasi Tol Perlu Dilakukan
2993,"7 Ruas Tol Dilelang, ATI: Bagus untuk Portofolio Investasi"
2994,"Bangun Kapal Wisata, Pelni Gelontorkan Dana Rp 6 Miliar"
2995,"Lagi, OJK Imbau UMKM agar Tak Terjerat Pinjaman Online Bodong"
2996,BPJT Komunikasi dengan Malaysia Terkait Investasi Jalan Tol
2997,Polisi: Korban Dugaan Penipuan Investasi Jamu Herbal Capai 1.765 Orang
2998,Jual-Beli Tol Bakal Marak Lima Tahun ke Depan
2999,"Heboh Fintech Pakai Data Pengguna Go-Jek, Grab, dan E-commerce, Ini Kata OJK"
3000,"Imbas Perang Dagang, Lebih dari 50 Perusahaan Asing Kabur dari China"
3001,Pemerintah Kejar Target Rp 100 Triliun Investasi Otomotif
3002,Industri Mainan Dalam Negeri Diharapkan Bisa Tarik Investasi
3003,IAP: RTRW Bukan Penghambat Investasi
3004,Saratoga Lebih Selektif Investasi di Bidang Infrastruktur
3005,Menperin Klaim Toyota dan Hyundai Siap Investasi Rp 50 Triliun untuk Kendaraan Listrik
3006,Terduga Pelaku Penipuan Investasi Jamu Herbal Ditangkap di Bogor
3007,"5 Fakta Penipuan Investasi Jamu Herbal, Tergiur Untung Besar hingga Pelaku Dijerat Pasal Pencucian Uang"
3008,"Jokowi dan Menlu Singapura Bahas Kerja Sama Infrastruktur, Investasi, dan SDM"
3009,Komisioner KPK: 50 Persen Lebih Investasi Tambang Langgar Aturan
3010,"Kritisi Kinerja Birokrasi, Sri Mulyani Sebut Belum Maksimal Tarik Investasi"
3011,"Facebook: Libra adalah Alat Pembayaran, Bukan investasi"
3012,"Rekonsiliasi Jokowi-Prabowo, Sinyal Positif Bagi Rupiah dan Investasi"
3013,Pelaku Penipuan Investasi Jamu Herbal Dijerat Pasal Pencucian Uang
3014,"Penipuan Investasi Jamu Herbal di Klaten Rugikan Ribuan Korban, Total Rp 17 M"
3015,Gubernur Sulsel Akan Pangkas Birokrasi Perizinan yang Persulit Investasi
3016,Wapres Ingatkan Pentingnya Keamanan Negara untuk Tarik Investasi
3017,"Dapat Dana Obligasi Rp 500 Miliar, Ini yang Dilakukan Waskita Beton"
3018,"Jangan Alergi terhadap Investasi, Ini Realisasi Investasi Era Jokowi-JK"
3019,"Investasi SBR007 Beli di Aplikasi digibank, Keuntungan Cair Tiap Bulan!"
3020,Jokowi: Jangan Ada yang Alergi Terhadap Investasi
3021,"Update Info tentang Real Estat Indonesia, Investasi, dan Sumber Modal di REII 2019 Conference"
3022,"Pidato Visi Indonesia, Jokowi Ancam Hajar Pungli dan Penghambat Investasi"
3023,Siapkan Dana Pendidikan Anak Bisa dengan Berbagai Jenis Investasi ini
3024,"Revisi UU Ketenagakerjaan, Investor Asing Perlu Iklim Usaha yang Kondusif"
3025,Ini Alasan Bank Asal Thailand Kucurkan Pendanaan untuk Go-Jek
3026,"Incar Investor Daerah, KSEI Bakal Gandeng BPD"
3027,Pertumbuhan Ekonomi Singapura Kuartal II 2019 Terburuk dalam 10 Tahun
3028,Ini Penyebab Izin Investasi Gorontalo Tinggi Namun Realisasi Rendah
3029,"7 Fakta SBR007, Instrumen Investasi Milenial"
3030,Minat Investasi SBR007? Begini Cara Belinya
3031,SBR007 Sudah Bisa Dipesan Hari ini
3032,"Mudahkan Investasi, Pemerintah Tekankan Fleksibilitas RTRW"
3033,Negosiasi Perdagangan AS dan China Kembali Berlanjut
3034,Jumlah Investor Reksa Dana Meningkat 3 Kali Lipat dalam 4 Tahun
3035,"Investasi SBR007 Cocok untuk Milenial, Ini Keunggulannya"
3036,"Penawaran SBR007 akan Dibuka, Investasi Bisa Mulai Rp 1 Juta"
3037,"Yuk Investasi, Pemerintah akan Buka Penawaran SBR007"
3038,Indonesia Investment Day Edisi Kedua akan Digelar di Singapura
3039,"""Peer-to-Peer Lending"" Bisa Jadi Investasi Menjanjikan Bagi ""First Jobber"""
3040,Peluang Investasi Industri Perfilman Masih Menjanjikan
3041,Go-Jek Kantongi Pendanaan dari Mitsubishi
3042,"Melantai di BEI, Envy Targetkan Dana Rp 222 Miliar"
3043,"Mau Persiapkan Dana Pendidikan, Pilih Asuransi atau Investasi?"
3044,"Beli Triumph Edisi Terbatas, Diklaim Bisa Jadi Investasi"
3045,Satgas Waspada Investasi Tutup 140 Aplikasi Pinjaman Online Ilegal
3046,"Jangan Terlilit Forex Bodong, Ada Sekolahnya!"
3047,"Saingi Alibaba, Ritel AS Ini akan Investasi 1,2 Miliar Dollar AS di China"
3048,"Di London, BI Ikut Tarik Investor untuk Tanam Modal di Indonesia"
3049,"Investasi di Industri Farmasi Turun, BKPM Curigai Hal Ini"
3050,Jaringan Hotel OYO Sebut Ciptakan 10.000 Peluang Ekonomi di Indonesia
3051,"Makin Mudah, Transaksi Reksa Dana Bisa Pakai Aplikasi di Ponsel"
3052,"Bahas Investasi, Jokowi Bakal Bertemu Bos SoftBank"
3053,"Putra Mahkota Arab Bakal ke Indonesia, Janji Investasi Besar-besaran"
3054,Ini Investasi yang Cocok untuk Milenial
3055,"Bentuk Kabinet, Kadin Sarankan Jokowi Pertimbangkan Sektor Ekonomi"
3056,Trik Berinvestasi Saham dengan Modal Minim
3057,Kondisi Politik Stabil Jadi Ladang Investasi Menarik
3058,Mau Investasi Deposito? Pertimbangkan 4 Hal Ini
3059,MUFG Suntik Rp 2 Triliun untuk Pendanaan Fintech Mitra Bank Danamon
3060,"Perluas Mitra Distribusi, MNC Asset Targetkan Dana Kelolaan Naik"
3061,"Milenial, Jangan Lupakan Investasi untuk Masa Depan"
3062,"Pasar Modal Masih Menjanjikan, Eastspring Investments Akan Luncurkan 5 Produk Baru"
3063,Pengusaha Besar Diajak Investasi di KEK Mandalika
3064,Menko Darmin Tak Mau Ambil Pusing soal Perang Dagang AS dan China
3065,Kadin Minta Kepastian Investasi di Pelabuhan Penunjang Tanjung Priok
3066,"Jangan Salah Hitung Bunga Deposito Bank, Begini Caranya"
3067,"Luncurkan Asuransi Premium, AXA Mandiri Tawarkan Proteksi sekaligus Investasi"
3068,"5 Saran World Bank untuk Pemerintah, Mulai dari Pendidikan hingga Investasi"
3069,68 Perusahaan Investasi Rp 64 Triliun untuk Pengembangan Desa
3070,"Punya Rp 1 Juta Per Bulan, Lebih Baik Ditabung, Deposito atau Reksa Dana?"
3071,"Pekan Ini 27 Emiten Bagikan Dividen, Simak Daftarnya"
3072,"Gelar MotoGP di Mandalika, Wagub NTB Rayu Pengusaha Prancis Investasi di Lombok"
3073,"Berkah Perang Dagang AS-China, Thailand Kebanjiran Investasi Asing"
3074,Olahraga Lari Investasi Mahal bagi Ibnu Jamil dan Susan Bachtiar
3075,"Jokowi: Kebijakan di Investasi, Perizinan, Tak Ada Tendangannya..."
3076,[POPULER MONEY] Laju Kereta Cepat Jakarta-Bandung 350 km/Jam | Investasi RI Kalah dari Vietnam
3077,Mandiri Capital Siapkan Rp 90 Miliar untuk Investasi di Startup Fintech
3078,"Bisnis Kura-kura Darat, Hobi yang Bawa Untung (1)"
3079,"Manfaatkan Perang Dagang, Ini Potensi Bisnis yang Bisa Diraih Indonesia"
3080,"Usai Pemilu, Banyak Investor Cari Tahu Potensi Investasi di Indonesia"
3081,Kenapa Investasi Indonesia Kalah dari Vietnam? Ini Kata Sri Mulyani
3082,Ajak Teman Beli Aset Kripto Bisa Dapat Uang Tambahan
3083,Irfan Bachdim Ikut Beli Saham Bali United
3084,Ketidakpastian Brexit Ancam Iklim Investasi Inggris
3085,5 Kesalahan Umum Saat Berinvestasi
3086,Sharp dan LG akan Relokasi Pabriknya ke Indonesia
3087,8 Jurus Berinvestasi Dana Pensiun dengan Dana Minim
3088,Jangan Berinvestasi Bila Kondisi Anda Seperti Ini
3089,"Nabung Emas di E-Commerce, Bisa Mulai Beli dengan Berapa Rupiah?"
3090,"Menginvestasikan Uang untuk Pendidikan Anak, Simak 3 Tipsnya"
3091,"Minat Investasi Emas di E-Commerce, Perhatikan 4 Hal Ini"
3092,Ini Dampak Perang Dagang AS-China ke Indonesia versi Bank Indonesia
3093,Mau Investasi Reksa Dana di E-Commerce? Ini Ragam Pilihan Produknya
3094,"Pajak Investasi Saham vs Obligasi, Mana Lebih Besar?"
3095,"Dorong Investasi, Pemerintah Bakal Revisi 2 PP soal KEK"
3096,Ini Alasan Untuk Mencairkan Dana Darurat
3097,5 Tips Memilih Skema Reksa Dana untuk Mendapatkan Imbal Hasil Terbaik
3098,"4 jutawan Ini Ungkap Investasi Terbaiknya, Mungkin Anda Mau Coba?"
3099,"Gandeng Akademisi Oxford, Papua Barat Susun Peta Jalan Investasi Hijau"
