,news
1314,"Politisi PKS Sebut Kementerian Investasi Tak Dibutuhkan, Ini Alasannya"
1315,Ingin Berinvestasi? Simak Dulu Perbedaan Reksa Dana Syariah dan Konvensional
1316,Tips Memilih Manajer Investasi agar Cuan dan Terhindar Investasi Bodong
1317,"Pemerintah Bentuk Kementerian Investasi, Anggota Komisi XI: Perbaikan Iklim Investasi Mutlak Dilakukan"
1318,"Pembentukan Kementerian Baru: Disetujui DPR, tetapi Peleburan Kemenristek Dianggap Langkah Mundur"
1319,"Di Usia 30 Tahun Bisa Kumpulkan Uang hingga Rp 100 Juta, Bagaimana Caranya?"
1320,BKPM Bakal Jadi Kementerian Investasi
1321,"Hasrat Jokowi Genjot Investasi, Bentuk LPI hingga Kementerian Investasi"
1322,"DPR Setujui Pembentukan Kementerian Investasi serta Kementerian Pendidikan, Kebudayaan, Riset, dan Teknologi"
1323,"Simak, Ini Cara Jadi Investor Bahagia Tak Takut Rugi"
1324,"Rugi Rp 7,38 Triliun, Bos Waskita Blak-blakan Ungkap Penyebabnya"
1325,Analis Kompak Prediksi IHSG Hari Ini Kembali Bergerak di Zona Hijau
1326,Menlu: Investasi Inggris ke RI Meningkat 35 Persen meski Terjadi Pandemi Covid-19
1327,"Sebelum Berinvestasi Saham, Ketahui Faktor Yang Bisa Menggerakkan Indeks"
1328,Proses Izin Usaha Disederhanakan Melalui Konfirmasi Kesesuaian Pemanfaatan Ruang
1329,Wacana Penyesuaian Investasi BPJS Ketenagakerjaan Masih Pengaruhi IHSG
1330,"Siapkan Dana Pendidikan Anak, Lirik 4 Investasi Cuan Ini"
1331,Pakar Unair Bagikan Tips Investasi bagi Pemula
1332,"Produsen Baterai Asal China Akan Investasi Rp 72,5 Triliun di Indonesia"
1333,[KURASI KOMPASIANA] Antara Invetasi dan Menabung | Kesalahan Investor Saham Pemula | Untung dan Rugi Investasi Emas
1334,Raffi Ahmad Habiskan Rp 300 Miliar untuk Investasi RANS Cilegon FC
1335,Tol Cengkareng-Kunciran dan Pamulang-Serpong Jalur Alternatif Baru Menuju Bandara Soekarno-Hatta
1336,"Investasi: Pengertian, Jenis, Contoh, dan Manfaatnya"
1337,"Tol Serpong-Pamulang dan Cinere-Kunciran Beroperasi, Jokowi Minta Pemda Perluas Investasi"
1338,"BPJS Ketenagakerjaan Pangkas Investasi Saham, Ini Komentar Para Analis"
1339,Riset: Investor Bakal Tingkatkan Investasi di Sektor Digital Indonesia dalam 2 Tahun ke Depan
1340,Tower City57 Apartemen Fifty Seven Promenade Tutup Atap
1341,"Anjlok 48 Persen, Pendapatan Waskita Tahun 2020 Hanya Rp 16,2 Triliun"
1342,"Hanya Lakukan Penyesuaian, BP Jamsostek Pastikan Tak Tarik Keseluruhan Dana dari Bursa"
1343,"BPJS Ketenagakerjaan Bakal Kurangi Investasi Saham dan Reksa Dana, Ini Respons BEI"
1344,"Harga Emas Bisa Tembus Rp 1,4 Juta Tahun Ini, Kapan Waktunya Beli?"
1345,Layanan Invest OVO Catat Pertambahan 250.000 Investor Baru
1346,"Tangkap Potensi Ekonomi Digital, Huawei Dorong Investasi R&D"
1347,"Pertemuan Menlu RI dan Jepang, Bahas soal Investasi hingga Proyek Infrastruktur"
1348,Xiaomi Investasi Rp 22 Triliun untuk Mobil Listrik Pintar
1349,"Imbal Hasil Treasury AS Naik, Saham-saham Sektor Apa yang Layak Dikoleksi?"
1350,Menhub: Nilai Investasi Pembangunan Ambon New Port Rp 5 Triliun
1351,Startup Asal Indonesia Paling Dilirik Investor Sepanjang 2020
1352,Investasi untuk Dana Menikah? Kenapa Tidak
1353,Menabung dan Mengumpulkan Modal Investasi Dalam 30 Hari
1354,"Prangko, Alat Bayar Pos yang Bermetamorfosis Jadi Benda Bernilai Investasi"
1355,[POPULER MONEY] Ide Bisnis yang Bisa Jadi Mesin Uang Pensiunan PNS | Rincian Gaji TNI AL
1356,"UEA Minat Investasi di Ibu Kota Baru, Ini Sektor yang Dilirik"
1357,"Putra Mahkota Abu Dhabi Perintahkan Tanam Investasi Rp 143,9 Triliun ke RI, Mengapa?"
1358,RI Butuh Rp 245 Triliun untuk Kembangkan Industri Baterai Kendaraan Listrik
1359,"UEA Suntikkan Rp 143 Triliun ke LPI, Kepercayaan Internasional ke Indonesia Tinggi"
1360,Amerika Serikat Siapkan Dana untuk Saingi Teknologi China
1361,"Tekan Gas Emisi Rumah Kaca, DSNG Bangun 6 Pabrik Bio-Cng Baru dengan Nilai Investasi Rp 676,8 Miliar"
1362,Pemprov DKI Dorong BUMD Angkutan Massal Raih Pendapatan Non-tiket
1363,"Telegram Dapat Suntikan Dana Rp 2,1 Triliun, Buka Kantor di Abu Dhabi"
1364,"[TREN FINANSIAL KOMPASIANA] ""Sleeping Investor"" di Usia Muda | Belajar Investasi Tanah | Adu Kuat Nilai Tukar Mata Uang"
1365,Amankah Investasi Emas Digital?
1366,"Mengenal Apa Itu Reksa Dana: Definisi, Jenis, Keuntungan dan Risiko"
1367,"Ada LPI, Sri Mulyani Tak Ingin BUMN Hanya Andalkan Suntikan Pemerintah"
1368,"Jadi Peluang Investasi, Bagaimana Target Transportasi Jakarta Tahun 2030?"
1369,"Peternak Habiskan Rp 1 T untuk Beli Pakan dari Pulau Jawa, Gubernur NTT: Kita Akan Buat Pabrik Sendiri"
1370,"Proyek TPPAS Lulut Nambo Dilanjutkan, Jabar Sedot Investasi 133,3 Juta Dollar AS"
1371,"UEA Tanam Modal Rp 143,9 Triliun di LPI, Ini Sektor-sektor yang Dilirik"
1372,"UEA Bakal Gelontorkan Rp 143,9 Triliun ke Indonesia, untuk Apa?"
1373,"Pemprov DKI: Rumah DP Rp 0 Harus untuk Tempat Tinggal, Bukan Obyek Investasi"
1374,"Ekonom: Formula E Tak Akan Berikan Dampak Turisme hingga Investasi, Wajib Dibatalkan"
1375,5 Film tentang Saham untuk Mengenal Dunia Investasi
1376,Eks Bos Bukalapak Suntik Dana Rp 72 Miliar ke Perusahaan Teknologi
1377, Airlangga Sebut Telah Berkonsultasi dengan 50 Perusahaan untuk Kembangkan LPI
1378,Ini Jenis Reksadana yang Catat Kinerja Terbaik Pekan Lalu
1379,Pemerintah Bakal Suntik LPI Rp 60 Triliun Tahun Ini
1380,Mau Investasi tapi Gaji Kecil? Ini 3 Instrumen Investasi yang Bisa Kamu Pilih
1381,"Petisi Tolak Penutupan Kode Broker Dinilai Tidak Relevan, Ini Alasannya"
1382,Duduk Perkara Investasi Bodong Aset Kripto Oknum PNS Riau yang Rugikan 3.000 Anggotanya
1383,"Oknum PNS di Riau Tipu 3.445 Warga dengan Modus Investasi Bodong, Kerugian Rp 60 Miliar"
1384,"Obrolan Raffi Ahmad dan Nagita Slavina, dari Investasi Berlian hingga Ballroom di Basement Rumah"
1385,[POPULER PROPERTI] 9 Tanaman Obat yang Punya Manfaat Kesehatan Luar Biasa
1386,"6 Jenis Investasi yang Populer di Indonesia, dari Deposito hingga Saham"
1387,"Sekali Lagi, Kata Ahli Sekarang Saatnya Beli Properti"
1388,"Rupiah dan IHSG Kompak Melemah Sore Ini, Net Sell Asing Capai Rp 257,2 Miliar"
1389,[TREN FINANSIAL KOMPASIANA] Pengelolaan Finansial Setelah Hamil | Pentingnya Menentukan Tujuan Investasi | Lagi-lagi Tertipu Investasi Bodong
1390,Ini Tips Berinvestasi Emas untuk Milenial
1391,"Syarat Pabrikan Mobil dapat Insentif PPnBM, Wajib Investasi Rp 5 T"
1392,"Pendapatan Tidak Menentu, Bisakah Freelancer Berinvestasi? Simak 4 Hal Ini"
1393,Sri Mulyani: Investasi Mobil Listrik Minimal Rp 5 Triliun agar Dapat Insentif
1394,KKP: Pemburu Harta Karun Asing Incar Kapal Flor de la Mar yang Tenggelam di Selat Malaka
1395,"3 Buku Ini Bisa Picu Kamu untuk Investasi, Apa Saja?"
1396,John Riady Anggap Pandemi Covid-19 Berkah Bagi Lippo
1397,"[KURASI KOMPASIANA] Analisa Pinjaman Modal Usaha Kecil | Tren Investasi Melawan YOLO dan FOMO | Cara Mengendus ""Fraud"" dalam Investasi Saham"
1398,Rahasia Sukses Gurita Bisnis Djarum hingga BCA: Siapkan Diri Hadapi Segala Situasi
1399,Guru Besar UI Soroti Pentingnya Ilmu Matematika Keuangan agar Paham Investasi
1400,"Harga Bitcoin Tembus Rp 800 Juta, Masih Berpotensi Menguat?"
1401,"Meraup Untung dari Investasi Apartemen, Tertarik?"
1402,"PT Rajawali Nusindo Resmikan Kantor Baru di Semarang, Hendi: Ini Bukti Investasi Masih Jalan"
1403,Indeks Dow Jones Sentuh Rekor Tertinggi Terodorong Prospek Ekonomi AS
1404,"Kasus Investasi Bodong Model Arisan di Inhu, Anggotanya Rugi hingga Rp 1 M, 31 Ketua Kelompok Diperiksa"
1405,"Beda dengan Jiwasraya, Investasi BP Jamsostek Dinilai Sesuai Kaidah"
1406,Menperin Akui Alot Negosiasi dengan Mazda untuk Investasi di Indonesia
1407,"Suzuki Bakal Tambah Investasi Rp 1,2 Triliun, buat Ertiga dan XL7 Hybrid"
1408,Ingin Tetap Bisa Berinvestasi di Tengah Pandemi? Lakukan Hal Ini
1409,Sejumlah Perusahaan Otomotif Jepang Akan Tambah Investasi di Indonesia
1410,"Ada Pembebasan Pajak, Dana Kelolaan Haji Lebih Tebal"
1411,"Bertolak ke Jepang, Menperin Kantongi Janji Penambahan Investasi Mitsubishi di Indonesia"
1412,"Luhut Ogah Mengemis Investasi ke Tesla: Hey, You Need Us"
1413,"Investor Ritel Tumbuh 48,82 Persen, OCBC NISP Gelar Program Peningkatan Literasi Keuangan"
1414,"24.000 Orang Tertipu Arisan Bodong di Riau, Kerugian Rp 21 Miliar"
1415,Wali Kota Palu Vs Menko Luhut Soal Larangan Membangun Infrastruktur di Palu
1416,Gojek Kucurkan Dana untuk LinkAja
1417,Luhut Pastikan Proses Investasi dengan Tesla Masih Berjalan
1418,"[POPULER OTOMOTIF] Di Tangan Builder Asal Gunungkidul, Sedan Biasa Diubah Jadi Supercar I Tesla Tidak Batal Investasi di Indonesia, tetapi Bukan Bikin Pabrik Mobil"
1419,"Tesla Tidak Batal Investasi di Indonesia, tetapi Bukan Bikin Pabrik Mobil"
1420,"Cara Membeli Saham bagi Pemula, Tahapan dan Modal yang Diperlukan"
1421,"100 Situs Perdagangan Berjangka Ilegal Diblokir Bappebti, Lagi-lagi Ada Binomo"
1422,Waskita dan HK Siap Lepas Ruas Tol yang Dikelola untuk LPI
1423,"Jual Tol Medan-Tebing Tinggi ke Investor Hong Kong, Waskita Raih Rp 824 Miliar"
1424,OJK: Portofolio Investasi Industri Asuransi Segera Dibatasi
1425,Pemda Diminta Turut Andil Jaga Iklim Investasi Jalan Tol
1426,Pemerintah Incar Investor Asing Garap Proyek Penyediaan Air Minum
1427,Cerita Jokowi Setiap Hari Telepon Kepala BKPM untuk Pantau Investasi
1428,Sri Mulyani Dekati Dubes Jepang demi Investasi Mobil Listrik
1429,"Investasi Bodong Berkedok Butik, Anggotanya 3.775 Orang dan Dana Terhimpun Rp 20 Miliar"
1430,Istana Bantah Wapres Ma'ruf Amin Tak Dilibatkan dalam Susun Aturan Investasi Miras
1431,Stafsus Erick Thohir: Kita Enggak Merasa Kecolongan Tesla Bangun Pabrik di India
1432,"Hingga 2024, Pertamina Butuh Dana Hingga Rp 1.311 Triliun"
1433,"Pertamina Akan Gelontorkan Investasi Rp 142,9 Triliun, untuk Apa?"
1434,"Saham Bank Kecil Melonjak Terus dalam Beberapa Hari hingga Disuspensi, Ada Apa?"
1435,"IHSG Pagi Ini Melaju di Zona Merah, Bagaimana dengan Rupiah ?"
1436,[POPULER MONEY] Ketua Umum PBNU Jadi Komut KAI | Lowongan Kerja BUMN
1437,Kepala BKPM Sebut Investasi Miras Usulan dari Pemda dan Masyarakat
1438,Sri Mulyani Sebut LPI Dapat Mengurangi Pembiayaan Lewat Utang
1439,"Presiden Cabut Aturan Investasi Miras di Perpres, PPP Ingatkan Soal RUU Larangan Minuman Beralkohol"
1440,Ini Cerita Kepala BKPM soal Aturan Investasi Miras hingga Akhirnya Dicabut Jokowi
1441,"Jokowi Cabut Aturan Investasi Miras, PKS: Pelajaran agar Pemerintah Lebih Cermat"
1442,"Ramai Twit Tugas Sekolah Unduh Snack Video dan Input Kode Referral, Ini Tanggapan Satgas Waspada Investasi"
1443,"Kisah Lionel Messi: Pernah Sentuh Miras, Kecanduan Soda, Kini Lebih Suka Minum Teh"
1444,[POPULER NASIONAL] Jokowi Cabut Aturan soal Investasi Miras | Rentetan Tudingan Jhoni Allen ke SBY
1445,"Aturan Investasi Miras Dicabut, Mahfud Sebut Pemerintah Tak Alergi Kritik dan Saran"
1446,"Izin Investasi Miras Dicabut, Kepala BKPM Minta Publik Stop Perdebatan"
1447,"Kisah Ronaldo dan Miras, Pernah Minum Sekali hingga Kematian Sang Ayah"
1448,"Janji Kampanye Anies Jual Saham Perusahaan Bir yang Belum Terealisasi, Mengapa?"
1449,Siapa yang Bujuk Jokowi Buka Investasi Miras?
1450,Dicabutnya Aturan Investasi Industri Miras...
1451,"Soal Saham Perusahaan Bir, F-PAN: Anies Harus Tegas seperti Jokowi Batalkan Perpres Investasi Miras"
1452,"Ramai soal Perpres Miras, Ini Penjelasan Mengapa Alkohol Memabukkan"
1453,"Muncul Aturan Investasi Industri Miras, Jubir: Posisi Wapres Tersudut"
1454,"Aturan Investasi Miras Dicabut, Yusril: Presiden Harus Terbitkan Perpres Baru"
1455,"Ketentuan Investasi Miras Dicabut, Biro Hukum Kepresidenan Dinilai Kurang Peka dengan Situasi"
1456,"Aturan Investasi Miras, Jubir: Persoalan Serius bagi Wapres kalau Berlanjut"
1457,"Sebut Ma'ruf Tak Tahu soal Aturan Investasi Miras, Jubir: Wapres Kaget, Terlebih Diserang di Medsos"
1458,Saltmine Raup Pendanaan Seri A Senilai Rp 285 Miliar
1459,"Aturan Investasi Miras Dicabut, Sebelumnya Ada Pertemuan 4 Mata Jokowi-Ma'ruf"
1460,"Aturan Investasi Industri Miras Dicabut, PBNU Berharap Pemerintah Tak Sembrono Buat Kebijakan"
1461,Aturan Investasi Industri Miras yang Hanya Bertahan Satu Bulan...
1462,Pernyataan Lengkap Jokowi soal Pencabutan Aturan Investasi Industri Miras dalam Perpres 10/2021
1463,"Aturan Investasi Miras Dicabut, PPP Minta Menteri dan Orang di Sekitar Presiden Hati-hati Beri Masukan"
1464,PP Muhammadiyah Apresiasi Langkah Presiden Cabut Aturan Investasi Miras
1465,"Aturan Investasi Miras Dicabut, Fraksi PAN: Langkah Konkret Presiden Redam Polemik"
1466,"Soal Aturan Investasi Miras, BKPM Akui Sempat Ada Perdebatan Panjang"
1467,"Jokowi Cabut Aturan Investasi Miras, MUI: Presiden Respons Aspirasi Masyarakat"
1468,"Aturan Investasi Miras Dicabut Jokowi, MUI Tunggu Salinan Keputusan"
1469,"Aturan Investasi Miras Dicabut, PBNU: Apresiasi Presiden yang Mau Menerima Masukan Ulama"
1470,Saran Ekonom ke Pemerintah Soal Perpres Investasi Minol
1471,"Tipu Warga hingga Rp 705 Juta, Seorang Tersangka Kasus Dugaan Penipuan Investasi Online Ditahan"
1472,Partai Gelora: Harusnya Pemerintah Fasilitasi Industri Herbal ketimbang Buka Investasi Miras
1473,"Kritik Perpres soal Investasi Miras, Sekum Muhammadiyah: Pemerintah Mestinya Bina Moral Masyarakat"
1474,Amien Rais Minta Jokowi Batalkan Perpres soal Investasi Miras
1475,Wagub Sulut Sebut Perpres Investasi Miras Bakal Bantu Puluhan Ribu Pembuat Cap Tikus
1476,"OJK Temukan 51 Pinjol Ilegal, Ini Daftarnya"
1477,"Kata Ekonom, Ini Manfaat Perpres Pelegalan Investasi Minol"
1478,"Direstui Jokowi, Gubernur Bisa Usul Buka Investasi Miras di Wilayahnya"
1479,"Fraksi PKS Minta Perpres soal Investasi Miras Dibatalkan, Dinilai Cederai Nilai Pancasila"
1480,"Bangkitkan Gairah Investasi Jalan Tol, ATI Tegaskan Pemerintah Harus Konsisten"
1481,Fraksi PAN Minta Pemerintah Kaji Ulang Aturan Investasi Miras
1482,Wakil Ketua MPR Nilai Aturan Investasi Miras Bertentangan dengan Pancasila
1483,Ekonom: Perpres Investasi Minol Bisa Tarik Investor Asing
1484,"Tolak Perpres Investasi Miras, Santri Pasundan Akan Ajukan Judicial Review ke MA"
1485,"Di Tengah Penurunan Suku Bunga, Reksa Dana Pasar Uang Masih Menjadi Opsi Investasi"
1486,"Kejar Target Produksi 1 Juta Barrel, Industri Hulu Migas Butuh Investasi Rp 3.500 Triliun"
1487,Investree Pasarkan Sukuk Ritel Seri SR014
1488,"Nilai Berdampak Buruk, PPP Minta Pemerintah Tak Buka Investasi Industri Miras"
1489,[POPULER OTOMOTIF] Suzuki Karimun 3 Baris Bakal Masuk Indonesia? | Viral Video Sunmori di Sekitar Istana Diberhentikan Petugas
1490,"Dugaan Investasi Bodong Berkedok Butik di Aceh, Himpun Rp 25 Miliar, Anggotanya 3.000 Orang"
1491,Facebook Siapkan Rp 14 Triliun untuk Kerja Sama dengan Media
1492,LPI Diklaim Mampu Serap 36.000 Tenaga Kerja di RI
1493,"Masyarakat Adat Kerap Terpinggirkan, Gus AMI Soroti Kebijakan Investasi"
1494,"Kasus Investasi Bodong, Polisi Amankan 5 Mobil Mewah Bos Butik dan Pegawainya"
1495,"Pemerintah Buka Pintu Investasi Industri Miras, Ini Komentar Pengusul RUU Larangan Minuman Beralkohol"
1496,"Besok Mulai Ditawarkan, Kupon Sukuk Ritel SR014 Ditetapkan 5,47 Persen"
1497,Istri Polisi Tertipu Rp 100 Juta Investasi Voucer Pulsa di Padang Pariaman
1498,Beberapa Sebab Kemungkinan Tesla Enggan Berinvestasi di Indonesia
1499,"Izin VTube Diklaim Sudah 99 Persen, Ini Kata Satgas Waspada Investasi"
1500,"Masih Ada Harapan, Kepala BKPM Sebut Negosiasi dengan Tesla Tetap Berjalan"
1501,BEI Ingatkan Investor Muda untuk Cari Informasi yang Kredibel
1502,Harapan Besar Pemerintah di Pundak Dewas dan Direksi Baru BPJS Ketenagakerjaan
1503,BEI Gencarkan Edukasi untuk Influencer
1504,"Pengamat: Kalau Negara Tidak Mau Rugi, Jangan Investasi di Pasar Modal"
1505,"Bersama BEI, Ajaib Sekuritas Menginisiasi 1.000 Program Generasi Saham"
1506,Dirut Baru BPJS Ketenagakerjaan Janji Optimalisasi Dana Investasi
1507,Pemerintah Terus “Pepet” Tesla agar Investasi di Indonesia
1508,"Ikut Investasi Voucher Internet, Warga Padang Pariaman Tertipu Rp 500 Juta"
1509,"Baru Punya Gaji? Pikirkan 4 Hal Penting Ini Sebelum ""Belanja-belanja"""
1510,Peringatan Menkeu AS soal Bahaya Bitcoin: Bisa Rugikan Investor hingga Masyarakat
1511,"Realisasi Investasi Hulu Migas Pada Januari 2021 Capai 873,2 Juta Dollar AS"
1512,"Terkait Audit Investasi BP Jamsostek, DPR Minta Hasilnya Diumumkan secara Terbuka"
1513,"Alihkan Investasi ke Bitcoin, Berapa Cuan yang Didapatkan Tesla?"
1514,"Tesla Diproyeksi Raup Keuntungan Rp 8,4 Triliun dari Pembelian Bitcoin"
1515,Berkas Perkara 13 Tersangka Korporasi Manajer Investasi Dugaan Korupsi Jiwasraya Lengkap
1516,Cara Bicara dengan Atasan soal Kelelahan dan Beban Kerja
1517,Mengenal Investasi Surat Berharga agar Masa Depan Berjaya
1518,"84,91 Persen Masyarakat Terlayani Akses Air Layak Minum"
1519,Ini Alasan Kripto Semakin Diminati Jadi Instrumen Investasi
1520,Luhut: Investasi di Sektor Air Bersih Sangat Kami Apresiasi
1521,"Tesla Pilih Bangun Pabrik Mobil Listrik di India, Pemerintah Diminta Lakukan ini"
1522,"Bisa Lewat Aplikasi di Ponsel, Investasi Reksa dana Semakin Antiribet dan Ramah Millenial"
1523,"Soal Investasi PMN, Komisi XI DPR: Kami Harap Manfaatnya Dirasakan Masyarakat"
1524,Ini Saran Pengusaha agar Pemerintah Bisa Genjot Investasi
1525,Berminat Investasi di Bitcoin dkk? Simak Caranya
1526,"Meski Banjir Investasi, Bali Harus Pertahankan Tradisi"
1527,"Lebih Tertarik ke India, Bagaimana Kesepakatan Tesla dengan Indonesia?"
1528,"Bukan Indonesia, Tesla Tertarik Bangun Pabrik Mobil Listrik di India"
1529,"Jika Kaya Raya Mendadak, Jangan Lupa Bayar Utang hingga Investasi"
1530,"5 Fakta VTube, dari Diblokir Kominfo hingga Investasi Ilegal"
1531,"Presiden Jokowi Umumkan Direksi Lembaga Pengelola Investasi, Apa Itu?"
1532,"Warren Buffett Lepas Saham-saham Bank, dan Masuk ke Saham Farmasi"
1533,"Apa Itu Bitcoin yang Harganya Tembus Rp 700 Juta, Serta Cara Belinya"
1534,"Menkeu Pastikan LPI Bertujuan Mencari Investasi, Bukan Pinjaman"
1535,"[TREN EKONOMI KOMPASIANA] Cara Meningkatkan Investasi Saham | Corona, Kredit Merana | Manfaatkan Kekuatan Budaya Perusahaan"
1536,Tertarik Investasi di Bitcoin dan Mata Uang Kripto Lainnya? Simak Dulu Tips Ini
1537,"Manajernya Jadi Direksi LPI, Ini Komentar Citi Indonesia"
1538,LPI Tegaskan Tidak Cari Dana Utang
1539,"Profil Direksi LPI, Mantan Bankir hingga Direktur Keuangan BUMN"
1540,"Dirut Lembaga Pengelola Investasi: Kami Cari Dana Modal, Bukan Pinjaman"
1541,Ini Direksi dan Dewan Pengawas Lembaga Pengelola Investasi
1542,Jokowi Minta DPR hingga BPK Dukung Lembaga Pengelola Investasi
1543,"Jokowi Umumkan Direksi Lembaga Pengelola Investasi, Ini Daftarnya"
1544,Jokowi: Indonesia Sangat Terlambat Membentuk Sovereign Wealth Fund
1545,"VTube Diblokir Kominfo, Ini Imbauan Satgas Waspada Investasi"
1546,"Ingin Belajar Saham, Perempuan Ini Jadi Korban Pembobolan Rekening"
1547,"Jangan Mudah Tergiur, Hati-hati Saat Ingin Investasi di Binomo Cs"
1548,Ingin Beli Tanah Murah dan Gak Ketipu? Cermati Tips Berikut Ini
1549,"Mengintip MNC Lido City, Proyek Hary Tanoe yang Disahkan Jadi KEK Bertaraf Internasional"
1550,"Realisasi Investasi di Kawasan Ekonomi Khusus Tembus Rp 23,1 Triliun"
1551,"Lido dan JIIPE Jadi Kawasan Ekonomi Khusus, Potensial Raup Investasi Ratusan Triliun"
1552,Saatnya untuk Diversifikasi Investasi ke Reksadana Saham?
1553,Apa Itu Bitcoin dan Mengapa Bernilai Tinggi?
1554,Apindo: Penurunan Nilai Investasi di BP Jamsostek Akibat Pandemi Covid-19
1555,"Soal Negosiasi dengan Tesla, Ini Kata Antam dan Inalum"
1556,"Modus Investasi Tembakau dan Gula, Penyanyi Dangdut Tipu Rekan Sesama Biduan hingga Rp 450 Juta"
1557,Penyanyi Dangdut Ini Tipu Sesama Biduan Senilai Rp 450 Juta dengan Modus Investasi
1558,"Reksadana Baru Trimegah AM, Investasi Bisa Mulai dari Rp 100.000"
1559,"Inspirasi Energi: Perusahaan Migas Eropa Ramai-ramai Investasi Energi Terbarukan, Ini Daftarnya"
1560,"Pekan Depan, Pemerintah RI dan Tesla Bahas Rencana Investasi"
1561,Kesamaan Asabri-Jiwasraya: Limbung Karena Tersangkut Saham Gorengan
1562,"Libatkan BUMN, Pemerintah Tak Ingin Tesla Cuma Ambil Bahan Baku"
1563,Pemerintah RI dan Tesla Berencana Bangun Semacam Power Bank Berkapasitas Besar
1564,"Proposal Investasi Tesla Telah Masuk, Berikut Analisis Saham INCO dan ANTM"
1565,"Tak Lazim Hotel Dijual di Marketplace, Pemilik Biasanya Bergerak Diam-diam Cari Investor"
1566,"Utang untuk Beli Saham, Apa Boleh?"
1567,Maju Mundur Kedatangan Tim Tesla ke Indonesia Hingga Rencana Negosiasi Pekan Depan
1568,"Marriott Buka 100 Hotel Baru, Tiga di Antaranya di Indonesia"
1569,Perusahaan Jepang dan Korsel Bakal Buka Pabrik AC di Indonesia
1570,Luhut Sebut Kehadiran LPI Bisa Dongkrak Produk Domestik Bruto
1571,Luhut: Kesepakatan NDA RI-Tesla Telah Diteken
1572,"Hutama Karya Garap Perumahan di Depok, Incar Penjualan Rp 644 Miliar"
1573,BKPM Sebut Realisasi Investasi 2020 Lampaui Target
1574,"Target Investasi 2021 Jadi Rp 900 Triliun, Luhut: Saya Kira Tidak Terlalu Sulit"
1575,"LPI Bisa Kelola Sumber Daya Alam untuk Investasi, Begini Mekanismenya"
1576,"Terganjal Kebijakan Larangan WNA ke Indonesia, Tim Tesla Batal ke Indonesia"
1577,Begini Perlakuan Perpajakan yang Dirancang Pemerintah Untuk Lembaga Pengelola Investasi
1578,"6 Kebiasaan yang Bikin Sulit Kaya, Menurut Para Miliarder"
1579,Sri Mulyani Beri Insentif Pajak Untuk Gaet Mitra Investasi LPI
1580,"Mengenal Investasi Sukuk: Definisi, Keuntungan, dan Cara Membelinya"
1581,"[Biografi Tokoh Dunia] Warren Buffett, Belajar dari Setiap Kegagalan Investasi"
1582,"Mahasiswa Ingin Investasi? Kenapa Tidak, Ini Tipsnya bagi Pemula"
1583,"Sambut Relokasi Investasi dari China dkk, Pemerintah: Ada 127 Area Industri Seluas 55.000 Hektar"
1584,Mendag Ajak Korsel Tingkatkan Investasi di Industri Kulkas dan AC
1585,"SWI Temukan 14 Perusahaan Investasi Tanpa Izin, Ini Daftarnya"
1586,[POPULER PROPERTI] Crown Group Raih Rp 65 Miliar dari Apartemen Artis
1587,Wamen BUMN: Lembaga Pengelola Investasi Akan Beroperasi Penuh Akhir Februari 2021
1588,"Jadi Pintu Gerbang Untuk Tarik Investasi ke RI, Apa Itu LPI?"
1589,3 Tips dari Polda Metro Jaya Hindari Jebakan Investasi Bodong
1590,"Dewan Pengawas LPI Para Profesional, Jokowi Harap Mereka Dapat Kepercayaan Dalam dan Luar Negeri"
1591,Kepala BKPM: Penanaman Modal Dalam Negeri Jadi Pahlawan Investasi 2020
1592,"Lebih dari Rp 1.000 Triliun Investasi Belum Terealisasi, Ini Langkah BKPM"
1593,"Jokowi Lantik Dewan Pengawas Lembaga Pengelola Investasi, Ini Nama-namanya"
1594,"Jokowi Lantik 5 Dewan Pengawas LPI, Simak Masing-masing Profilnya"
1595,"Menperin: Di Tengah Pandemi, Industri Sumbang ""Double Digit"" pada Investasi"
1596,"Investasi Saham Bukan untuk Main-main, Ketahui Risikonya Sebelum Beli"
1597,"Living World Kota Wisata, Mal Terbesar di Timur Jakarta Telan Investasi Rp 1,4 Triliun"
1598,Airlangga: Ada 1.700 Bidang Usaha yang Dibuka untuk Investasi
1599,"Agar Nasabah Tak Salah Paham, Agen Asuransi Perlu Jelaskan Hal Ini"
1600,"Dorong Milenial Berinvestasi, Manulife, OVO dan Bareksa Luncurkan MOBLI"
1601,Menko Airlangga: Bakal Ada 2 Jenis Fund di LPI
1602,Dana Hasil Penjualan Surat Utang ORI019 untuk Membiayai Vaksinasi
1603,Pemerintah Bisa Dapat Porsi dari Laba LPI hingga 30 Persen
1604,Wapres: Pengelolaan Wakaf Uang Perlu Kerja Sama dengan Manajer Investasi
1605,Jokowi Perintahkan Bahlil Gaet Investasi Rp 900 Triliun di 2021
1606,Vaksin Covid-19 dan UU Cipta Kerja Dianggap Jadi Pendongkrak Investasi
1607,"Didongkrak Investasi, Pertumbuhan Ekonomi RI 2021 Diprediksi Capai 4,4 Persen"
1608,Sri Mulyani Jelaskan Urgensi Pembentukan LPI kepada DPR
1609,Tertarik Beli ORI019? Begini Caranya
1610,"Investor Mulai Beralih dari AS ke China, Ini Alasannya"
1611,"ORI019 Sudah Bisa Dibeli, Ini 26 Mitra Distribusinya"
1612,"ORI019 Resmi Ditawarkan Hari Ini, Minat?"
1613,"Lampaui AS, China Jadi Negara yang Datangkan Investasi Asing Langsung Terbesar Selama Pandemi Covid-19"
1614,"ORI019 Ditawarkan Mulai Besok, Ini Besaran Kuponnya"
1615,Menko Luhut Binsar Pandjaitan Siap Jadi Ketua PB PASI
1616,7 Tips Memulai Investasi Syariah bagi Milenial dari Pakar IPB
1617,Sinarmas Janjikan Serah Terima Apartemen Klaska Mei 2021
1618,Erick Thohir Tak Ingin Lembaga Pengelola Investasi Indonesia seperti 1MDB
1619,"Joe Biden Resmi Jadi Presiden AS, Ini Harapan Pemerintah dalam Hal Investasi"
1620,"Cerdas Investasi Saham agar Tak Buntung, Jangan Pakai ""Uang Panas"""
1621,"Minat Investasi Meningkat, DBS Tawarkan Reksa Dana Syariah dan Ramah Lingkungan"
1622,"Soal Dugaan Korupsi Pengelolaan Keuangan dan Dana Investasi, Ini Penjelasan BPJS Ketenagakerjaan"
1623,"Jangan Buru-buru Beli Saham, Simak Dulu Tips Praktisi Pasar Saham Ini"
1624,"Bappebti, Investasi Saham, dan Pemblokiran 1.191 Situs Pialang Berjangka Ilegal..."
1625,Kejagung Dalami Dugaan Korupsi Terkait Pengelolaan Keuangan dan Investasi oleh BPJS Ketenagakerjaan
1626,"Walau Diterpa Pandemi, BPJamsostek Tetap Catatkan Kinerja Positif Sepanjang 2020"
1627,"Masih Dibayangi Pandemi, Ini Jurus Pemerintah Kejar Target Investasi Sektor Migas"
1628,Polri Periksa 23 Saksi Terkait Dugaan Penipuan PT Jouska
1629,Beli Saham Pakai Utang? Simak Ini
1630,[POPULER PROPERTI] Tarif 8 Ruas Tol Naik Serentak
1631,"Minggu, Tarif 8 Ruas Tol Naik Serentak, Ini Rincian Lengkapnya"
1632,"Ekonomi Masih Sulit, Investasi Saham Lanjut Terus atau Tunda Dulu?"
1633,Presiden Ingin Nama-Nama Dewan Pengawas LPI Selesai Dikaji Minggu Depan
1634,"Sektor Properti Bangkit jika Pertumbuhan Ekonomi di Atas 4,8 Persen"
1635,Mengupas Kerja Sama Investasi China di Indonesia
1636,"Penambahan Infrastruktur Listrik Jauh dari Target, Realisasi Investasi Ketenagalistrikan Hanya 59 Persen"
1637,Tren Sukuk Global Berprinsip Keberlanjutan di Tengah Pandemi Covid-19
1638,Dana Haji akan Diinvestasikan ke Mana Saja?
1639,"Setelah Divaksin, Jokowi Langsung Bahas LPI dengan Sri Mulyani dan Erick Thohir"
1640,Uni Eropa Gelontorkan Rp 653 Miliar untuk Indonesia Lewat PT SMI
