,news
0,"Penggugat Tolak Dana Kerahiman dari Yusuf Mansur Terkait Kasus Wanprestasi, Ini Alasannya"
1,"Mediasi Kasus Wanprestasi, Yusuf Mansur Diminta Ganti Rugi Imateriel hingga Rp 300 Juta"
2,Ini Alasan Penggugat Yusuf Mansur Batal Minta Ganti Rugi yang Dikonversi Nilai Emas
3,"Mediasi Kasus Wanprestasi Yusuf Mansur, Tuntutan Ganti Rugi Kini Tak Dikonversi Nilai Emas"
4,"Polisi Tangkap Bandar Arisan Bodong di Kalsel, Korban Rugi Ratusan Juta Rupiah"
5,"Bareskrim Duga Kerugian 550 Korban Kasus Robot ""Trading"" Fahrenheit Mencapai Rp 480 Miliar"
6,"BI: Jeleknya Infrastruktur, Pelabuhan, Gratifikasi, Perburuk Investasi Bengkulu"
7,"Ingin Hijrah ke Investasi Syariah, Perhatikan Dulu Hal ini"
8,Sandiaga Uno Ajak Investor Australia Berinvestasi di Indonesia
9,Tiga Faktor Ini Bikin Orang Masih Terjebak Investasi Bodong
10,LPSK Bandingkan Penanganan Kasus Kerangkeng Manusia dengan Investasi Ilegal: Kalau Tidak Mampu Serahkan ke Bareskrim
11,"Total Kerugian akibat Investasi Bodong Capai Rp 117,5 Triliun, Bisakah Uangnya Kembali?"
12,Kejati Jateng Ungkap Korupsi Berkedok Investasi di BUMD Rembang
13, Ini 6 Aplikasi Investasi Bodong yang Berasil Terungkap Sepanjang 2022
14,Berminat Buka Bisnis SPBU Shell? Ini Persyaratan Lokasinya
15,"Penggugat Tolak Dana Kerahiman dari Yusuf Mansur Terkait Kasus Wanprestasi, Ini Alasannya"
16,"Mediasi Kasus Wanprestasi, Yusuf Mansur Diminta Ganti Rugi Imateriel hingga Rp 300 Juta"
17,Ini Alasan Penggugat Yusuf Mansur Batal Minta Ganti Rugi yang Dikonversi Nilai Emas
18,"Mediasi Kasus Wanprestasi Yusuf Mansur, Tuntutan Ganti Rugi Kini Tak Dikonversi Nilai Emas"
19,"Polisi Tangkap Bandar Arisan Bodong di Kalsel, Korban Rugi Ratusan Juta Rupiah"
20,"Bareskrim Duga Kerugian 550 Korban Kasus Robot ""Trading"" Fahrenheit Mencapai Rp 480 Miliar"
21,"BI: Jeleknya Infrastruktur, Pelabuhan, Gratifikasi, Perburuk Investasi Bengkulu"
22,"Ingin Hijrah ke Investasi Syariah, Perhatikan Dulu Hal ini"
23,Sandiaga Uno Ajak Investor Australia Berinvestasi di Indonesia
24,Tiga Faktor Ini Bikin Orang Masih Terjebak Investasi Bodong
25,LPSK Bandingkan Penanganan Kasus Kerangkeng Manusia dengan Investasi Ilegal: Kalau Tidak Mampu Serahkan ke Bareskrim
26,"Total Kerugian akibat Investasi Bodong Capai Rp 117,5 Triliun, Bisakah Uangnya Kembali?"
27,Kejati Jateng Ungkap Korupsi Berkedok Investasi di BUMD Rembang
28, Ini 6 Aplikasi Investasi Bodong yang Berasil Terungkap Sepanjang 2022
29,Berminat Buka Bisnis SPBU Shell? Ini Persyaratan Lokasinya
30,"OJK: Piutang Multifinance Mulai ""Bertenaga"", Didorong Pembiayaan Modal Kerja dan Investasi"
31,"Kasus TPPU Rahmat Effendi, KPK Dalami Pengumpulan Uang dari ASN untuk Investasi Pribadi"
32,Tol Kamal-Teluk Naga-Rajeg Ditargetkan Beroperasi Tahun 2025
33,Prediksi Arah Ekonomi Makro dan Pokok-pokok Kebijakan Fiskal 2023
34,"Divestasi adalah Kebalikan Investasi, Ini Pengertian dan Dampaknya"
35,Polisi Sebut Kerugian Sementara Kasus Robot Trading DNA Pro Capai Rp 97 Miliar
36,Polisi: Development Manager Binomo Brian Edgar Nababan Ditangkap di Bali
37,Ketua MPR Berharap ICCA dapat Kurangi Investasi Bodong Berkedok Trading
38,"Bukan dari APBD, Nilai Investasi MRT Fase 3 Cikarang-Balaraja Tembus Rp 160 Triliun"
39,Juventus Vs Inter: Investasi Vlahovic Lebih Bernilai dari Ronaldo
40,Pengusaha Jepang Lirik Investasi Wisata Kesehatan di Bali
41,"Ratusan Warga di Garut Diduga Jadi Korban Investasi Bodong, Kerugian Capai Rp 4 Miliar"
42,"Cetak Transaksi Rp 3,5 Triliun, JLL Jadi Penasihat Investasi Real Estat Terbaik"
43,Jubir Presidensi G20 Maudy Ayunda: Ini Kesempatan RI Dorong Dunia untuk Pulih
44,"China Bertekad Dukung Pembangunan IKN, Investasi Masih Tunggu Rencana Spesifik"
45,"Klarifikasi Indra Bekti Terseret Investasi Bodong Triumph: Saya ""Brand Ambassador"", Bukan Afiliator...."
46,"Investasi Bodong Triumph Diduga Rugikan Korbannya Rp 2,3 Miliar, Seret Nama Artis Indra Bekti"
47,"Kembali Bicara Penundaan Pemilu, Menteri Investasi: Pengusaha Butuh Kepastian dan Stabilitas Politik"
48,"Banyak Dikaitkan Investasi Bodong, Apakah Semua Robot Trading Ilegal?"
49,"Investasi Saham hingga Aset Kripto Tak Selamanya Untung, Ini yang Perlu Dicermati Investor Pemula"
50,"G20 di Solo Bahas Isu Perdagangan, Investasi dan Industri dalam Pemulihan Ekonomi Global"
51,"4 Bos Investasi Bodong Rp 84,9 M di Pekanbaru Divonis 14 Tahun Penjara, Harta Disita untuk Bayar Kerugian Korban"
52,3 Cara yang harus Disiapkan Sebelum Memulai Investasi
53,"Sepanjang 2021, Realisasi Investasi Indonesia Tembus Rp 901 Triliun"
54,"Investor AS Kembali Jajaki Investasi di Kepri, Begini Penjelasan Dubes AS"
55,"SPBU Shell Modular, Bisnis dengan Investasi SPBU yang Lebih Terjangkau"
56,"Eks Dirut Taspen dan ""Owner"" PT Sekar Wijaya Diduga Lakukan Korupsi dari Dana Investasi Rp 150 Miliar"
57,"Laporan Arus Kas: Tujuan, Fungsi, Penyusunan, dan Klasifikasinya"
58,Luhut Klaim Jokowi Disenangi dan Dihormati Para Pemimpin Dunia
59,"Di Hadapan Para Kepala Desa, Luhut Puji Jokowi Punya Banyak Kelebihan yang Tak Dimiliki Pemimpin Lain"
60,Tips untuk Berinvestasi Aset Kripto di 2022
61,"Sri Mulyani: Infrastruktur adalah Investasi Strategis, tapi..."
62,"Incar Investasi dari China, Taliban Sekarang Melestarikan Buddha"
63,"PDI-P: ""Big Data"" Luhut soal Penundaan Pemilu Terbantahkan"
64,8 Kesalahan Umum Investor Pemula
65,"Kewajiban Neto Investasi Internasional RI Naik Jadi 278,6 Miliar Dollar AS"
66,"Distribusikan Reksa Dana, Eastspring Indonesia Gandeng Pluang"
67,Masih Menarikkah Investasi Emas di Era Digital?
68,"Bijak Sebelum Membeli NFT, Tak Semua Orang Seberuntung Ghozali Everyday"
69,Permintaan Maaf Indra Kenz dan Pesan untuk Memilih Investasi
70,"Jangan Sampai Tertipu, Ini Ciri-ciri Investasi Bodong yang Perlu Diwaspadai"
71,"[POPULER OTOMOTIF] Tilang Elektronik di Jalan Tol Siap Diberlakukan, Tindak Overspeed dan ODOL | Tegas, Ini 4 Syarat Pemerintah untuk Investasi Tesla di Indonesia"
72, Saatnya Investor Melirik Prospek Investasi Berbasis ESG
73,Pemerintah Sebut Unilever Bakal Investasi 135 Juta Euro Tahun Ini
74,Polisi Sudah Periksa 64 Saksi untuk Kasus Penipuan Berkedok Investasi Indra Kenz
75,"PPATK Hentikan Sementara Transaksi Rekening yang Diduga Investasi Ilegal Senilai Rp 502,88 Miliar"
76,"Keberatan Yusuf Mansur Kembalikan Investasi ke Nilai Emas, Kuasa Hukum: Jangan Menuntut di Luar Batas Kemampuan..."
77,"Tolak Beri Ganti Rugi Pakai Nilai Emas, Pihak Yusuf Mansur: Rp 10 Juta Kok Jadi Rp 200 Juta?"
78,"Sebut Penanganan Pandemi Covid-19 Berhasil, Luhut Singgung Pengalamannya Saat Jadi Prajurit Kopassus"
79,Luhut ke Tesla: Jangan Kau yang Bikin Syarat...
80,"Tanpa Melalui Sidang, Yusuf Mansur Disebut Bisa Kembalikan Dana Investasi"
81,"Yusuf Mansur Hanya Bisa Kembalikan Investasi Tanpa Dikonversi ke Nilai Emas, Ini Alasannya"
82,"Yusuf Mansur Bersedia Kembalikan Dana Investasi, Kuasa Hukum: Harus Diverifikasi Dulu"
83,"Berbagai Kasus Investasi Bodong yang Diungkap Polisi: Binomo, Quotex, Fahrenheit, dan Evotrade"
84,Profil Haris Azhar dan Fatia Maulidiyanti yang Jadi Tersangka Pencemaran Nama Baik Luhut
85,"Penahanan Bos Robot ""Trading"" Fahrenheit yang Rugikan Korbannya Ratusan Miliar Rupiah"
86,[POPULER MONEY] Profil Putra Siregar | Model Investasi Fahrenheit | Jokowi Perbolehkan Mudik
87,Kuasa Hukum Korban Kecewa Sidang Kasus Investasi Emas Ditunda karena Pihak Terdakwa Belum Siap
88,"Kasus Dugaan Penipuan Investasi Emas Dinilai Perkara Besar, Eks Pegawai KPK Ungkap Alasannya"
89,"Gugatan Korban Belum Direspons, Sidang Dugaan Penipuan Investasi Emas di Tangsel Diundur hingga Pekan Depan"
90,"Hendry Susanto, Bos Fahrenheit yang Janjikan Cuan, tapi Malah Bikin Rugi Korban Ratusan Miliar Rupiah"
91,Cara Hendry Susanto Tipu Para Investor Lewat Robot Trading Fahrenheit
92,Kumpulan Soal Kombinasi Bisnis Akuntansi Keuangan Lanjutan 1
93,"Kronologi Penangkapan Hendry Susanto, Bos Robot Trading Fahrenheit yang Kini Jadi Tersangka"
94,Ingin Buka Bisnis SPBU Shell? Ini Besaran Modal Investasi yang Harus Disiapkan
95,"Bos Trading Fahrenheit Ditangkap, Seperti Apa Model Investasinya?"
96,"Sidang Kasus Penipuan Investasi Emas Kembali Digelar Hari Ini, Korban Didampingi Eks Pegawai KPK"
97,"Puluhan Orang Dilaporkan Jadi Korban Perumahan Syariah Bodong di Bekasi, Depok, dan Bogor"
98,"Bos Robot Trading Fahrenheit Hendry Susanto Ditangkap, Langsung Ditahan Bareskrim Polri"
99,Bos Perusahaan Robot Trading Fahrenheit Hendry Susanto Ditangkap Bareskrim Polri
100,Terungkapnya Investasi Bodong Robot Trading Fahrenheit Usai Ratusan Orang Jadi Korban...
101,"Kritik Politik ""Semau Gue"" dalam Wacana Tunda Pemilu dan Masa Jabatan Presiden"
102,3 Jenis Investasi Jangka Pendek yang Cocok Buat Pemula
103,Polda Metro Jaya Kejar Direktur Perusahaan Pengelola Robot Trading Fahrenheit
104,"Robot Trading Fahrenheit Pakai Slogan ""Diam Duduk, Dapat Duit"" untuk Rayu Korban"
105,Bingung Investasi Emas atau Bitcoin? Simak 4 Perbedaan Keduanya Berikut!
106,"Hati-hati Investasi Bodong, Ketahui Tips Investasi dan Cara Cek Legalitasnya"
107,Deretan Bantahan Luhut Soal Tudingan Main Tambang di Papua Usai Haris Azhar-Fatia Jadi Tersangka
108,"Haris Azhar-Fatia Tersangka, Aktivis: Bentuk Kemerosotan Demokrasi"
109,Luhut Diminta Buat Bantahan soal Main Tambang di Papua ketimbang Terus Perkarakan Haris Azhar-Fatia
110,Haris Azhar-Fatia Tersangka Dinilai Bukti Pejabat Sulit Terima Kritik
111,"Hati-hati Investasi Palsu, Simak Tips dari Pakar UM Surabaya"
112,"Agar Tidak Rugi Besar Kena Investasi Bodong, Pakar UGM Kasih Tips Ini"
113,"Agar Tidak Kena Tipu, Begini Cara Cek Investasi Bodong ala Pakar UGM"
114,"Polda Metro Akan Buka Posko Pengaduan Korban Penipuan Investasi Robot ""Trading"" Fahrenheit"
115,"Polisi Tangkap 3 Pelaku Robot ""Trading"" Fahrenheit, Berikut Masing-masing Perannya"
116,"Investasi Robot Trading Fahrenheit, SWI: Sudah Disetop sejak Desember"
117,Apa Itu Robot Trading Fahrenheit? Dilaporkan atas Kasus Penipuan Investasi
118,[POPULER NUSANTARA] Pria Menumpang di Kolong Bus dari Merak ke Lampung | Nakes dan Anaknya Dibunuh
119,"Marak Investasi Bodong atau Ilegal, Investasi Apa yang Aman? Ini Tips dari BEI"
120,"Belajar dari Kasus Binomo, Ini 4 Tips Memilih Investasi"
121,"Teka-teki Pemilik Binomo Mulai Terkuak, Ada di Karibia Diduga Terima Dana Rp 125 Miliar"
122,Siapa Hendy Setiono? Bos Kebab Baba Rafi yang Dilaporkan Dugaan Penipuan Investasi Bodong
123,"""Seolah Semua Masalah Hidup Selesai dengan Uang"""
124," Keluarga Korban Investasi Bodong Rp 84,9 M di Pekanbaru Berharap Aset yang Disita Bisa untuk Bayar Kerugian"
125,"Softbank Mundur dari Pendanaan IKN, Kepala Otorita: Tak Usah Terlalu Khawatir"
126,Kuasa Hukum Penggugat Sebut Yusuf Mansur Hanya Bisa Kembalikan Investasi Tanpa Dikonversi ke Nilai Emas
127,"PPATK Sebut Dana Investasi Ilegal Mengalir ke Sejumlah Negara, Ada ke Situs Judi di Rusia"
128,"PPATK Sebut Aliran Dana Investasi Ilegal Disamarkan ke Berbagai Pihak, Termasuk Balita"
129,"Meskipun Pandemi, Nilai Investasi di Pangkalpinang Capai Rp 3,3 Triliun"
130,Polda Metro Sebut Korban Investasi Bos Baba Rafi Diduga Rugi hingga Rp 9 Miliar
131, 4 Faktor Ini Bisa Bikin Harga Rumah Naik di Masa Depan
132,Bos Baba Rafi Dilaporkan ke Polda Metro Jaya Terkait Dugaan Investasi Bodong Tambak Udang
133,"Pemilik Binomo Diduga di Kepulauan Karibia, Terima Dana Ilegal Jutaan Euro"
134,"PPATK Bekukan 29 Rekening yang Diduga Terkait Investasi Ilegal, Nilainya Rp 7,2 Miliar"
135,"Luhut Sang Menteri Segala Urusan dari Investasi sampai Pemilu, Ini 15 Peran Sentralnya"
136,Luhut: Putra Mahkota Kerajaan Arab Saudi WA Saya Tanya Progres Investasi IKN Nusantara
137,"Kunjungi Kejaksaan Agung, Kepala Otorita IKN Lakukan Konsultasi Hukum"
138,Luhut kepada Negara Maju: Tak Perlu Ajarin Kami Apa yang Harus Dilakukan...
139,"Indonesia Tawarkan 47 Proyek Investasi Senilai Rp 155,12 Triliun"
140,"Saat 8 Warga Tergiur Investasi Emas, Berakhir Rugi Rp 53 Miliar, Ajukan Tuntutan Didampingi Eks Pegawai KPK..."
141,"Menjaga Kewarasan di Tengah ""Bombardir"" Tawaran dan Iklan Investasi Ilegal"
142,"Ahli: Rasa Khawatir Uang Hilang Itu Sebenarnya Ada, tetapi Dikalahkan ""Fantasi"" Dapat Untung Besar dan Cepat"
143,Kata Kuasa Hukum soal Kliennya Dituntut Bayar Rp 53 Miliar oleh Eks Pegawai KPK
144,Terdakwa Kasus Penipuan Investasi Emas Dituntut Bayar Rp 53 Miliar oleh Eks Pegawai KPK
145,"Investasi Emas Malah Rugi Rp 12 Miliar, Mulanya Korban Tertarik Keuntungan Melimpah"
146,"Sembari Mengenali Cara Kerjanya, Ini 6 Rekomendasi Produk Investasi bagi Pemula"
147,"Dugaan Penipuan Investasi Emas di Tangsel, Salah Satu Korban Rugi Rp 12 Miliar"
148,"Eks Pegawai KPK Dampingi 8 Korban Investasi Emas di PN Tangerang, Ini Duduk Perkaranya"
149,"Didampingi Eks Pegawai KPK, 8 Korban Investasi Emas Ajukan Tuntutan di PN Tangerang"
150,BP Tapera Prioritaskan Kualitas Rumah Masyarakat Berpenghasilan Rendah
151,"Softbank Mundur, Luhut Sebut Abu Dhabi-China Siap Investasi 20 Miliar Dollar AS di IKN Nusantara"
152,Permintaan Maaf Doni Salmanan demi Mendapat Hukuman Ringan...
153,"Softbank Mundur dari Proyek IKN Nusantara, Begini Langkah Pemerintah"
154,"Mulai Besok, Investasi Reksa Dana Mansyaf Tersedia di BCA"
155,"Softbank Batal Investasi di IKN Nusantara, Luhut: Sejak Awal Sudah Mundur..."
156,"Menangis Minta Dibebaskan, Ini Sosok Maryani ""Branch Manager"" Terdakwa Investasi Bodong Rp 84,9 M di Pekanbaru"
157,"Cara Mendapatkan Penghasilan Tambahan, Dijamin Cuan!"
158,"Softbank Batal Investasi di IKN Nusantara, Begini Kata Ekonom"
159,"Terdakwa Kasus Investasi Bodong Rp 84,9 M Menangis Minta Dibebaskan, Jaksa Tetap pada Dakwaannya"
160,"Crazy Rich Indonesia, dan Laporan Kekayaan dalam Perspektif ESG"
161,"Fokus ""Return"" Tinggi, Investor Milenial Wajib Perhatikan Ini"
162,PPP Wanti-wanti Pemerintah Tak Gantikan Batalnya Investasi SoftBank di IKN dengan APBN
163,"Edukasi Investasi Saham Syariah, Mahasiswa ITS Hadirkan Arshaka Finance"
164,Faktor Apa Saja yang Pengaruhi Softbank Mundur Investasi dari Proyek IKN?
165,Tanggapan Pemerintah Soal SoftBank Mundur dari Investasi Proyek IKN Nusantara
166,Nasib Pembiayaan Ibu Kota Baru Pasca-mundurnya SoftBank dari Proyek IKN
167,"Softbank Mundur Investasi 100 Miliar Dollar AS di IKN, Apa Sebabnya?"
168,"Pernah Disebut Luhut Ingin Investasi 100 Milliar Dollar AS, SoftBank Batal Investasi di IKN"
169,"Simak 3 Potensi Tersembunyi dari Emas, Ternyata Cukup Menguntungkan"
170,SoftBank Mundur dari Investasi Proyek Ibu Kota Negara Nusantara
171,Polisi Telusuri Aset Doni Salmanan di Bandung
172,"Belajar dari Kasus Indra Kenz-Doni Salmanan, Ini Daftar Investasi Ilegal Tahun 2022"
173,Bandara Juanda Surabaya Buka untuk Penerbangan Luar Negeri dan Umrah
174,"Bersama Kementerian Investasi, Kemendesa PDTT Ajak Investor Kembangkan BUMDes"
175,Doni Salmanan Mulai Trading Bermodal Rp 280.000 hingga Terjerat Kasus Investasi Bodong
176,[POPULER NUSANTARA] PO Harapan Jaya Digugat KAI | Terduga Teroris Tewas Ditembak Densus 88 di Sukoharjo
177,"Enam Hotel Baru Dibangun di Kulon Progo, Dampak Kehadiran Bandara YIA"
178,"Buat Investor Pemula, Simak Tips Terhindar dari Platform Investasi Bodong"
179,Punya Investasi Saham hingga Obligasi? Simak Cara Lapornya di SPT Pajak
180,Kriminolog Sebut Faktor Tamak Penyebab Masyarakat Terjebak Investasi Ilegal
181,"Ada Harapan Uang Korban Indra Kenz dan Doni Salmanan Dikembalikan, Aliran Dana Ditelusuri Sampai Karibia"
182,"Buru Tersangka Kasus Investasi Bodong Indosurya, Bareskrim Terbitkan Red Notice"
183,"Kuasa Hukum Penggugat Yusuf Mansur Berharap Mediasi Selesaikan Masalah: Kalau Berlarut-larut, Klien Teraniaya"
184,"Terdakwa Kasus Investasi Bodong Rp 84,9 M di Pekanbaru Minta Dibebaskan Saat Sidang: Saya Harus Hidupi Keluarga"
185,"Mulai Dibangun Juni, Ini Sejumlah Fakta Tol Kedua di Pulau Dewata"
186,"Upaya Pengembalian Uang, Kabareskrim Sarankan Korban Invetasi Ilegal Bentuk Paguyuban"
187,"Belajar dari Kasus Indra Kenz dan Doni Salmanan, Ini Cara Hindari Iming-iming ""Cuan Instan"" Investasi Bodong"
188,"Kasus Wanprestasi, Yusuf Mansur Diharapkan Hadir Langsung Saat Mediasi"
189,"Diminta Ganti Ratusan Juta Rupiah, Yusuf Mansur Disebut Masih Diskusi dengan Kuasa Hukum"
190,"Mediasi Kasus Wanprestasi, Yusuf Mansur Juga Diminta Bayar Kerugian Rp 500 Juta"
191,"Dana Investasi Penggugat Dikonversi ke Harga Emas, Yusuf Mansur Diminta Bayar Rp 273 Juta"
192,Menteri Bahlil Ungkap UEA Bakal Tingkatkan Investasi di Indonesia
193,"Telusuri Aliran Dana Indra Kenz, Polisi Duga Ada Pelaku Lain di Kasus Binomo"
194,Yusuf Mansur Diminta Kembalikan Pokok Investasi yang Dikonversi ke Harga Emas
195,"Terkait Investasi Ilegal, 121 Rekening Senilai Hampir Rp 355 Miliar Dibekukan PPATK"
196,"Jika Para Tergugat Hadir, Sidang Wanprestasi Yusuf Mansur Masuk Tahap Mediasi"
197,"Menanti Penelusuran Aset Indra Kenz dan Doni Salmanan, Mungkinkah Uang Korban Kembali?"
198,"Pertama di Indonesia, Tol Gilimanuk-Mengwi Dilengkapi Jalur Sepeda, Telan Investasi Rp 24,6 Triliun"
199,"Sepanjang 2021, Asuransi Jiwa Kelola Dana Investasi Rp 530,71 Triliun"
200,"Pemerintah Cari Investor untuk Bangun IKN, Begini Progresnya"
201,Satgas Waspada Investasi: Tak Ada Pengembalian Kerugian Investasi Ilegal 100 Persen
202,"Jika Beroperasi, Tol Gilimanuk-Mengwi Pangkas Waktu Tempuh Jadi 1,5 Jam"
203,Polisi Tracking Aliran Dana Doni Salmanan dan Bakal Disita
204,KSP: Perpres Turunan UU IKN Terbit Bertahap hingga April 2022
205,Mengenal Lagi Binary Option dan Quotex yang Jerat Doni Salmanan Jadi Tersangka Penipuan
206, Sepak Terjang Doni Salmanan yang Terancam Hukuman 20 Tahun Penjara Akibat Investasi Bodong
207,"Sosok Doni Salmanan, Tersangka Penipuan Quotex yang Terancam 20 Tahun Penjara"
208,Bareskrim Blokir Rekening dan Lacak Aset Doni Salmanan Terkait Kasus Qoutex
209,"Begini Nasib Doni Salmanan Sekarang, Jadi Tersangka dan Ditahan"
210,Erick Thohir Sebut UEA Tertarik Tingkatkan Kerja Sama Sektor Kesehatan hingga Energi di Indonesia
211,Menilik Fenomena Influencer dan Artis yang Jadi Afiliator Trading Seperti Indra Kenz
212,"Marak Investasi Bodong, Ganjar Minta OJK Makin Aktif Edukasi Masyarakat"
213,Ada Jalur Khusus untuk Motor di Tol Gilimanuk-Mengwi
214,Tol Gilimanuk-Mengwi Mulai Dibangun Juni 2022
215,"PPJT Tol Kedua di Pulau Dewata Resmi Diteken, Nilai Investasi Rp 24,6 Triliun"
216,Jumlah Crazy Rich Indonesia Naik 1 Persen Selama Pandemi Jadi 1.403 Orang
217,East Ventures Buka Peluang Pendanaan Untuk Sektor Teknologi
218,"PPATK Duga Sejumlah ""Crazy Rich"" Cuci Uang dengan Beli Mobil sampai Rumah Mewah"
219,"Pelaku Perjalanan Domestik Tidak Perlu Tunjukkan Hasil PCR dan Antigen, tapi..."
220,"Marak Kejahatan Berkedok Investasi, Pemerintah Diminta Perkuat Literasi Keuangan Digital"
221,"Kemenperin Targetkan Substitusi Impor 35 Persen Tahun Ini, untuk Menarik Investasi"
222,Populasi Orang Terkaya Indonesia Naik 1 Persen Selama Pandemi
223,"Tips agar Tidak Mudah Terjerat Investasi Bodong yang Diiklankan ""Influencer"" di Medsos"
224,"Masih Ada ""Influencer"" Iklankan Investasi Bodong di Medsos, Pengamat: OJK Harus Tegas Tertibkan"
225,Ciri Investasi Ilegal Menurut Pakar Ekonomi UM Surabaya
226,Proyek Jalan Tol Akses IKN Masuk Rencana KPBU Tahun 2022
227,Kenapa Emas Jadi Pilihan Buat Investasi? Simak 5 Keuntungannya
228,"Kasus Penipuan Binomo: Indra Kenz Jadi Tersangka, Doni Salmanan Dilaporkan"
229,Bagaimana Regulasi NFT yang Ideal di Indonesia?
230,"Mampukah Rusia Bertahan dengan Gempuran Sanksi, Boikot dan Anjloknya Rubel?"
231,Aturan Baru dan Daftar 332 Tujuan Investasi Tax Amnesty Jilid II
232,"Dituntut 12 Tahun, Terdakwa Kasus Investasi Bodong Bos Fikasa Group Menangis Saat Sidang"
233,"Ada Pabrik Baterai Mobil Listrik, Potensi Investasi di Karawang Diprediksi Makin Menggeliat"
234,7 Furnitur Abadi yang Bisa Menjadi Investasi Jangka Panjang
235,"Bandar Arisan Bodong di Sumedang Minta Maaf Tak Bisa Kembalikan Uang Korban, Ini Pengakuannya"
236,"Perang Rusia-Ukraina, Bagaimana Dampaknya ke Investasi Reksa Dana?"
237,"Beli atau Sewa Rumah, Mana yang Terbaik bagi Generasi Milenial?"
238,"Tahun Ini, Crazy Rich Dunia Banyak Belanja Perkantoran"
239,Madura United Pastikan Tidak Terlibat Pencucian Dana Viral Blast
240,"Didukung Sinarmas dan Tokocrypto, Token NanoByte (NBT) Diluncurkan"
241,"Birokrasi, Harga dan Pengembangan PLTA di Indonesia"
242,"Viral karena Ghozali Everyday, Sebenarnya Apa Sih NFT Itu?"
243,"Mulai Konstruksi 2022, Dua SPAM Ini Telan Investasi Rp 4,3 Triliun"
244,Ingin Investasi Kripto? Simak Dulu Tipsnya Biar Tidak Tertipu Investasi Bodong
245,"Dugaan Investasi Bodong di Sumedang, Kerugian Korban Disebut Mencapai Rp 16 M"
246,Investasi PLTA Diyakini Akan Semakin Murah
247,Cara Kenalkan Investasi ke Anak Sejak Dini
248,Simak Prosedur Pengajuan dan Cara Aktivasi Kartu Emas Pegadaian
249,"Pendiri Startup, Simak Cara Menyusun ""Cap Table"" untuk Memikat Investor"
250,"Galeri NFT Pertama di Indonesia, Pamerkan 11.110 Karya"
251,Tips Hindari Investasi Bodong dari Dosen UMM
252,"Satu Lagi ""Reseller"" Investasi Bodong di Lamongan Jadi Tersangka, Kerugian Rp 368 Juta"
253,Ingin Investasi Properti? Cek Lokasi yang Paling Dicari Berikut Ini
254,Luhut soal Usulan Penghapusan Karantina Wisman di Bali: Kita Tunggu 2 Minggu ke Depan
255,Investasi Real Estat Asia Pasifik Capai Rp 2.545 Triliun
256,Investasi Sektor Logistik di Asia Pasifik Melejit
257,"Masyarakat Diminta Tidak ""Trading"" di Gotrade karena Berpotensi Merugikan"
258,"Sidang Wanprestasi Yusuf Mansur Ditunda hingga 4 Kali, Penggugat: Kita Berbaik Sangka"
259,"Investasi Bodong Meresahkan, Ini Tips dari BEI untuk Investor Pemula"
260,Kuasa Hukum Yusuf Mansur Kini Juga Wakili 2 Tergugat Lain dalam Kasus Wanprestasi
261,"Ketua Majelis Hakim Terpapar Covid-19 dan Isoman, Sidang Wanprestasi Yusuf Mansur Ditunda"
262,Asosiasi Perdagangan Berjangka Siap Perangi Promosi Investasi Bodong yang Menjamur di Media Sosial
263,"Banyak Korban Investasi Bodong Berkedok Trading Forex, Literasi Diperkuat"
264,Menteri Bahlil Lahadalia: Milenial Berpeluang Jadi Pengusaha
265,Mau Investasi? Pahami 5 Hal Ini Supaya Tidak Rugi
266,"Prospek Reksa Dana Saham Masih Cuan, Simak Strategi Memilihnya"
267,Asosiasi Perdagangan Berjangka Beberkan Alasan Iklan Investasi Bodong Bisa Marak di Media Sosial
268,"Ada Tapering AS, Seberapa Cuan Berinvestasi di Obligasi Tahun Ini?"
269,"Dalam Investasi Saham Tidak Ada yang Pasti, Investor Ritel Wajib Perhatikan Ini"
270,Jokowi Sebut 80 Persen Anggaran IKN Berasal dari KPBU dan Investasi Langsung
271,Jokowi: 2 Juta Kendaraan Listrik Ditargetkan Bisa Dipakai Masyarakat Tahun 2025
272,"PPATK Temukan Rp 28,24 Miliar di Rekening yang Diduga Terkait Investasi Bodong"
273,"Baru Keluar dari Penjara, Eks Bos Investasi Bodong Kembali Ditangkap, Rp 5,6 Miliar Disita"
274,PPATK Pantau Aliran Dana yang Terkait Investasi Bodong
275,"Kisah Kreator Konten TikTok Tertipu Investasi Bodong, Bibit Ajak Masyarakat Jadi Investor Bijak"
276,"Belajar dari Kasus Viral Blast, Simak Tips Menghindari Investasi Bodong"
277,PDS Hadirkan 4 Show Unit Apartemen Antasari Place
278,"Polisi Amankan 3 Tersangka Investasi Bodong Senilai Rp 1,2 Triliun"
279,China Peringatkan Warganya soal Penipuan di Metaverse
280,"Merasa Tertipu, Sejumlah Pengguna Investasi Viral Blast Global Lapor ke Polda Metro Jaya"
281,"Tumbuhkan Lapangan Kerja, Realisasi Investasi Kota Surabaya Terbesar Kedua di Indonesia"
282,"Pinjaman hingga Rp20 Juta dari PIP untuk Pelaku Ultra Mikro, Ini Syaratnya"
283,PIP Targetkan 2 Juta Pelaku Usaha Ultra Mikro Terima Pembiayaan Tahun 2022
284,"Ovo Investasi Reksadana Masuk Daftar Investasi Bodong, Ini Kata Bos OVO"
285,Menteri Investasi: Saya Mohon Kerja Sama dan Rajin Mendatangi Para Investor
286,Cara Top Up Saldo Tabungan Emas Pegadaian secara Online dan Offline
287,Mau Buka Tabungan Emas di Pegadaian? Simak Syarat dan Cara Daftarnya
288,"Realisasi Investasi 2021 di Jakarta Rp 103,3 Triliun, Naik 8,8 Persen"
289,"Inflasi dan Suku Bunga dalam Tren Naik, Kenapa ORI Masih Diburu Investor Ritel?"
290,"Adopsi Investasi Hijau Masih Sulit, Bos BI Beberkan 3 Strateginya"
291,"Satgas Waspada Investasi Setop Kegiatan 21 Entitas Ilegal pada 2022, Ada ""Money Game"", Aset Kripto, dan ""Robot Trading"""
292,"Hati-hati Tertipu, Ini Daftar 50 Pinjol Ilegal yang Ditutup Satgas Waspada Investasi"
293,Indra Kenz Janji Hentikan dan Hapus Konten Terkait Binary Option Usai Bertemu Bappebti dan Satgas Waspada Investasi
294,"OJK Blokir 21 Money Game, Kripto, dan Robot Trading Ilegal, Ini Daftarnya"
295,"""Owner"" Viral Blast Akui Tipu Member, Satgas Waspada Investasi Desak Korban Kumpulkan Bukti, Cepat Lapor Polisi"
296,"Satgas Waspada Investasi Minta Indra Kenz hingga Doni Salmanan Hentikan dan Hapus Konten Promosi ""Binary Option"" dan ""Trading"""
297,"Optimalkan Penyaluran Pembiayaan Ultra Mikro, KemenKopUKM Kolaborasi dengan PIP"
298,"Agar Tak Rugi, Simak Tips Jitu Membeli Properti"
299,"Dukung Penangkapan Ikan Terukur, Kementerian KP Promosikan Peluang Investasi"
300,"Tahun 2023, Pemerintah Patok Nilai Investasi Rp 1.800-Rp 1.900 Triliun"
301,"Cerita Dyota Marsudi, Pria Muda yang Sukses dari Dunia Investasi ke Perbankan"
302,Korban Akui Terima Uang dan Olivia Nathania Selenggarakan CPNS Bodong Bersama Pihak Lain
303,"Dorong Literasi dan Inklusi Keuangan Civitas Academica, IPB Hadirkan Galeri Investasi"
304,Ajaib Luncurkan Fitur Transaksi Margin dengan Bunga 14 Persen
305,"Berawal dari Teman Diskusi Saham di Stockbit, Dua Investor Ini Jadi Teman Hidup"
306,"Polisi Kembali Tetapkan ""Reseller"" Investasi Bodong Lamongan sebagai Tersangka"
307,"Seluk-beluk Profesi Detektif Kencan, Bertugas Halau Penjahat Asmara di Dating Apps"
308,"Sebelum Terjun di Dunia NFT, Simak 7 Risiko NFT Menurut Pakar"
309,INFOGRAFIK: Mengenal Skema Ponzi dan Sejarah Modus Penipuan Itu Bermula
